,Wiki name,Wiki URL,Vertical,Primary image,Description,Secondary image 1,Secondary image 2,Secondary image 3,Secondary image 4,Secondary image 5
,BioShock Wiki,bioshock.wikia.com,Video Games,http://images2.wikia.nocookie.net/joeplayground/images/f/f0/BioShock320.jpg,"BioShock Wiki is a database for the BioShock video game series. The wiki is dedicated to preserving all information related to the worlds of Rapture and Columbia, including characters, enemies, weapons, items, walkthroughs and more.",,,,,
,Witcher Wiki,witcher.wikia.com,Video Games,http://images2.wikia.nocookie.net/joeplayground/images/2/25/Witcher320.jpg,"Witcher Wiki is a community site that aims to create the best resource for Witcher books by Andrzej Sapkowski, The Witcher games and other adaptations. Find extensive information on characters, monsters, places, quests and more.",,,,,
,Fable Wiki,fable.wikia.com,Video Games,http://images2.wikia.nocookie.net/joeplayground/images/7/7f/Fable320.jpg,"Fable Wiki is a comprehensive database for the Fable video game series. The wiki is dedicated to collecting all information related to the franchise, such as characters, quests, locations, weapons, enemies and more.",,,,,
,Camp Half-Blood Wiki,camphalfblood.wikia.com,Entertainment,http://images3.wikia.nocookie.net/joeplayground/images/8/8a/CampHalfBlood320.jpg,"Camp Half-Blood Wiki is the #1 source for the Camp Half-Blood universe, including the Percy Jackson and the Olympians books series, The Heroes of Olympus book series, The Lightning Thief movie and more.",,,,,
,Hot Wheels Wiki,hotwheels.wikia.com,Lifestyle,http://images3.wikia.nocookie.net/joeplayground/images/1/1b/HotWheels320.jpg,"Hot Wheels Wiki is a reference guide to Hot Wheels die-cast model cars, designers and variants where you can browse by year, series, manufacturer, designer or alphabetically. Collectors are encouraged to add their knowledge to the site.",,,,,
,Soulcalibur Wiki,soulcalibur.wikia.com,Video Games,http://images4.wikia.nocookie.net/joeplayground/images/6/62/Soulcalibur320.jpg,"Soulcalibur Wiki is a site based on the Soul series of fighting games developed by Namco. It has information on all of the aspects of each game, such as characters, various weapons, stages, secrets, and more.",,,,,
,God of War Wiki,godofwar.wikia.com,Video Games,http://images2.wikia.nocookie.net/joeplayground/images/1/17/GodOfWar320.jpg,"God of War Wiki is a collaborative encyclopedia for everything related to the God of War series. Here you will find detailed information on every game as well as the gods, titans, enemies, items, and more. ",,,,,
,Fullmetal Alchemist Wiki,fma.wikia.com,Entertainment,http://images3.wikia.nocookie.net/joeplayground/images/1/1b/FullmetalAlchemist320.jpg,"Fullmetal Alchemist Wiki is a free reference website for everything related to the Fullmetal Alchemist franchise, including extensive information on the manga chapters, anime episodes, video games, movies, and more.",,,,,
,SpongeBob SquarePants Wiki,spongebob.wikia.com,Entertainment,http://images2.wikia.nocookie.net/joeplayground/images/0/07/SpongeBob320.jpg,"SpongeBob SquarePants Wiki is a community database for everything related to SpongeBob SquarePants. The wiki features episodes, transcripts, characters, places, Entertainment, video games, merchandise, and more.",,,,,
,Kirby Wiki,kirby.wikia.com,Video Games,http://images3.wikia.nocookie.net/joeplayground/images/9/94/Kirby320.jpg,"Kirby Wiki is the ultimate resource for everyone's favorite pink puffball, Kirby. Here you will find information related to Kirby's abilities, video games, characters, items, Entertainment, anime, and much more.",,,,,
,SmashWikia,super-smash-bros.wikia.com,Video Games,http://images2.wikia.nocookie.net/joeplayground/images/a/af/SmashWikia320.jpg,"SmashWikia was created to compile a complete repository of information relating to the Super Smash Bros. franchise, including the games themselves, characters, stages, strategies and techniques, competitive play, and more.",,,,,
,Thomas the Tank Engine Wiki,ttte.wikia.com,Entertainment,http://images2.wikia.nocookie.net/joeplayground/images/6/60/Thomas320.jpg,"Thomas the Tank Engine Wiki is a site dedicated to the world's favourite tank engine, Thomas. With over 3,400 pages and 25,000 pictures, the wiki has extensive details on every character, episode and merchandise.",,,,,
,Gearspedia,gearsofwar.wikia.com,Video Games,http://images4.wikia.nocookie.net/joeplayground/images/6/63/Gearspedia320.jpg,"Gearspedia is a site dedicated to the accumulation of canonical information about the Gears of War series of video games and related media. Everything you want to know about the COG, the Locust Horde or anything else can be found here.",,,,,
,Club Penguin Wiki,clubpenguin.wikia.com,Video Games,http://images3.wikia.nocookie.net/joeplayground/images/d/d2/ClubPenguin320.jpg,"Club Penguin Wiki is a knowledge base for the popular online game, Club Penguin. The wiki's goal is to collect all aspects of the game including characters, places, items, events, mini-games, slang, and more. ",,,,,
,Degrassi Wiki,degrassi.wikia.com,Entertainment,http://images3.wikia.nocookie.net/joeplayground/images/d/dd/Degrassi320.jpg,"Degrassi Wiki is the community site that covers all four of the Degrassi television series, their characters, episodes, cast, and crew. You will also find a plethora of pictures, as the wiki has over 40,000 and counting.",,,,,
,Silent Hill Wiki,silenthill.wikia.com,Video Games,http://images3.wikia.nocookie.net/joeplayground/images/c/c2/SilentHill320.jpg,"Silent Hill Wiki is a database that covers multiple aspects of the Silent Hill universe, including all of the video games, the 2006 film, and the comics, as well as character information, puzzle solutions, item descriptions and game synopses.",,,,,
,Warriors Wiki,warriors.wikia.com,Entertainment,http://images4.wikia.nocookie.net/joeplayground/images/6/6c/Warriors320.jpg,"Warriors Wiki is an active community site devoted to Firestar, Jayfeather, Fading Echoes and all of the cats of the Warriors series by Erin Hunter. Share your love and knowledge of the novels, short stories, manga, and clans.",,,,,
,Villains Wiki,villains.wikia.com,Entertainment,http://images1.wikia.nocookie.net/joeplayground/images/8/85/Villains320.jpg,"Villains Wiki is dedicated to creating a database of villains from all media, ranging from cartoons to movies, books, video games and comics. Without the villain, there is rarely a plot, and this wiki aims to showcase the characters we all love to hate. ",,,,,
,Castlevania Wiki,castlevania.wikia.com,Video Games,http://images1.wikia.nocookie.net/joeplayground/images/c/c6/Castlevania320.jpg,"Castlevania Wiki is a collaborative encyclopedia for everything related to the Castlevania series, including over 3,500 pages of information about the games, characters, monsters, locations, guides, soundtracks, and more.",,,,,
,Smallville Wiki,smallville.wikia.com,Entertainment,http://images1.wikia.nocookie.net/joeplayground/images/9/91/Smallville320.jpg,"Smallville Wiki is a fan-made site dedicated to the CW television show, Smallville. Here you will find details on all the characters, relationships, seasons, episodes, cast, places, objects, as well as the latest news.",,,,,
,Charmed Wiki,charmed.wikia.com,Entertainment,http://images3.wikia.nocookie.net/joeplayground/images/8/85/Charmed320.jpg,"Charmed Wiki is a collaborative project to help create a definitive encyclopedia for the hit television show Charmed. The wiki contains information on characters, episodes, cast, crew, powers, novels, comics, and more. ",,,,,
,Mortal Kombat Wiki,mortalkombat.wikia.com,Video Games,http://images3.wikia.nocookie.net/joeplayground/images/f/fd/MortalKombat320.jpg,"Mortal Kombat Wiki is a site dedicated to the Mortal Kombat series, featuring information about characters, locations, weapons, maps, screenshots, videos, walkthroughs, guides, fatalities, movies, and more.",,,,,
,Fire Emblem Wiki,fireemblem.wikia.com,Video Games,http://images3.wikia.nocookie.net/joeplayground/images/6/63/FireEmblem320.jpg,"Fire Emblem Wiki is the definitive source of knowledge for the Fire Emblem franchice, containg information on the main games, spin-off games, characters, enemies, locations, weapons, items, races, Entertainment, and more.",,,,,
,Koei Wiki,koei.wikia.com,Video Games,http://images4.wikia.nocookie.net/joeplayground/images/5/5b/Koei320.jpg,"Koei Wiki is a collaborative project where users can freely add information about anything related to Koei, especially their video game series, such as Dynasty Warriors, Samurai Warriors, Warriors Orochi, and more.",,,,,
,EVA Database,cnc.wikia.com,Video Games,http://images2.wikia.nocookie.net/joeplayground/images/d/d3/EVAdatabase320.jpg,"EVA Database is a database focusing on the Command & Conquer video game series. You'll find all information related to the franchise, such as the games, organizations, characters, locations, arsenals, missions and more.",,,,,
,South Park Archives,southpark.wikia.com,Entertainment,http://images1.wikia.nocookie.net/joeplayground/images/c/cd/SouthPark320.jpg,"South Park Archives is a community-generated website for the South Park series created by Matt Stone and Trey Parker. Find lots of information on Cartman, Kyle, Stan, Kenny and every other character, as well as episodes, trivia and more.",,,,,
,Half-Life Wiki,half-life.wikia.com,Video Games,http://images2.wikia.nocookie.net/joeplayground/images/f/fa/HalfLife320.jpg,"Half-Life Wiki is a comprehensive encyclopedia focusing on the Half-Life and Portal universe by collecting information such as the games, characters, enemies, creatures, factions, locations, weapons, technology, and more.",,,,,
,Buffyverse Wiki,buffy.wikia.com,Entertainment,http://images2.wikia.nocookie.net/joeplayground/images/3/30/Buffy320.jpg,"Buffyverse Wiki is a community knowledge base devoted to Joss Whedon's Buffy the Vampire Slayer and its spin-off Angel. With 3,700 pages, you'll find details on characters, episode guides, novels, and comics from both series.",,,,,
,Forgotten Realms Wiki,forgottenrealms.wikia.com,Video Games,http://images2.wikia.nocookie.net/joeplayground/images/b/b4/ForgottenRealms320.jpg,Forgotten Realms Wiki is a collection of lore from the Forgotten Realms campaign setting for Dungeons & Dragons 4th edition and its predecessors. The wiki aims to provide a reference to the official source material released in the past decades.,,,,,
,Simpsons Wiki,simpsons.wikia.com,Entertainment,http://images2.wikia.nocookie.net/joeplayground/images/6/66/Simpsons320.jpg,"Simpsons Wiki is a collaborative database focusing on everything related to The Simpsons. With more than 8,000 pages, the wiki contains information on every character, episode, and location, as well as the movie, books, games, and more.",,,,,
,Inheriwiki,inheritance.wikia.com,Entertainment,http://images2.wikia.nocookie.net/joeplayground/images/e/e7/Inheritance320.jpg,"Inheriwiki is a community site serving as a comprehensive reference for the Inheritance Cycle franchise, including information on the books, characters, factions, places, dragons, organizations, and more.",,,,,
,Metal Gear Wiki,metalgear.wikia.com,Video Games,http://images3.wikia.nocookie.net/joeplayground/images/6/64/MetalGear320.jpg,"Metal Gear Wiki is the ultimate resource of knowledge for the Metal Gear video game franchise. In addition to all canonical and non-canonical games, the wiki also covers remakes, updates, Entertainment, and even the people who develop the games.",,,,,
,Dofus Wiki,dofuswiki.wikia.com,Video Games,http://images2.wikia.nocookie.net/joeplayground/images/5/54/Dofus320.jpg,"Dofus Wiki is a free content encyclopedia for the MMORPG, Dofus, with over 10,000 pages related to every aspect of the game including quests, classes, professions, locations, weapons, equipment, monsters, and much more.",,,,,
,Avatar Wiki,avatar.wikia.com,Entertainment,http://images2.wikia.nocookie.net/joeplayground/images/7/77/Avatar320.jpg,"Avatar Wiki is a fan-made resource for Avatar: The Last Airbender and Legend of Korra. Here you will find a wealth of information ranging from characters, organizations, locations, episodes, comics, video games, the movie, and everything else.",,,,,
,Warhammer 40k Wiki,warhammer40k.wikia.com,Video Games,http://images1.wikia.nocookie.net/joeplayground/images/b/bb/Warhammer40k320.jpg,"Warhammer 40k Wiki is a collaborative project to create the most definitive and accurate reference for everything related to the Warhammer 40,000 universe.",,,,,
,StarCraft Wiki,starcraft.wikia.com,Video Games,http://images2.wikia.nocookie.net/joeplayground/images/9/9d/StarCraft320.jpg,"StarCraft Wiki is a community database dedicated to documenting the StarCraft universe. Within its 4,500 pages you'll find detailed information on the games, expansions, units, characters, races, storyline, and more. ",,,,,
,Transformers Wiki,transformers.wikia.com,Entertainment,http://images4.wikia.nocookie.net/joeplayground/images/6/6a/Transformers320.jpg,"Transformers Wiki is a knowledge base devoted to the Transformers franchise, covering the TV series, comic books, Entertainment, real-life people, objects, technology, planets, and anything else related to Transformers.",,,,,
,Mega Man Knowledge Database,megaman.wikia.com,Video Games,http://images3.wikia.nocookie.net/joeplayground/images/0/0a/MegaMan320.jpg,"Mega Man Knowledge Database is a community site for the Mega Man video game series. The wiki contains all information related to the franchise, such as the games, characters, enemies, items, cartoons, anime, comics, manga, and more.",,,,,
,Family Guy Wiki,familyguy.wikia.com,Entertainment,http://images1.wikia.nocookie.net/joeplayground/images/8/82/FamilyGuy320.jpg,"Family Guy Wiki is a fan-made site that aims to be the most comprehensive source of information on Family Guy, including character bios, episode guides, filmography, inside jokes, hidden messages, voice actors, and more.",,,,,
,Memory Beta,memory-beta.wikia.com,Entertainment,http://images3.wikia.nocookie.net/joeplayground/images/b/bf/MemoryBeta320.jpg,"Memory Beta is an encyclopedia of non-canonical Star Trek information, including novels, comic books, RPG sourcebooks, video games and any other licensed works. Read about culture, characters, technology, starships, and more.",,,,,
,Pro Wrestling Wiki,prowrestling.wikia.com,Entertainment,http://images1.wikia.nocookie.net/joeplayground/images/2/21/ProWrestling320.jpg,"Pro Wrestling Wiki is a collaborative project to create a dynamic resource for information on professional wrestling. It is a place to find general information about all your favorite professional wrestling promotions and personalities, past and present.",,,,,
,Diablo Wiki,diablo.wikia.com,Video Games,http://images3.wikia.nocookie.net/joeplayground/images/4/4b/Diablo320.jpg,"Diablo Wiki is player-driven database containing more than 4,200 pages about the Diablo series of video games. For each game you will find walkthroughs and information on classes, skills, items, quests, monsters, and more.",,,,,
,One Wiki to Rule Them All,lotr.wikia.com,Entertainment,http://images3.wikia.nocookie.net/joeplayground/images/a/af/LOTR320.jpg,"One Wiki to Rule Them All is the definitive knowledge base for the Lord of the Rings books and films as well as anything related to J.R.R. Tolkien's fantasy universe of Middle-earth, including role-playing games, video games, and more.",,,,,
,TARDIS Index File,tardis.wikia.com,Entertainment,http://images2.wikia.nocookie.net/joeplayground/images/5/56/TARDIS320.jpg,"TARDIS Index File contains over 27,000 pages related to Doctor Who, Torchwood, The Sarah Jane Adventures, K9 and the rest of the Doctor Who universe. Here you wil find culture, society, locations, planets, species, and much more.",,,,,
,Stargate Wiki,stargate.wikia.com,Entertainment,http://images4.wikia.nocookie.net/joeplayground/images/1/11/Stargate320.jpg,"Stargate Wiki is a comprehensive database dedicated to Stargate:SG-1, Stargate:Atlantis, Stargate:Universe, Stargate:Infinity, and the Stargate movies, books, and games. Information covers characters, cast, planets, races, and more.",,,,,
,Castle Age Wiki,castleage.wikia.com,Video Games,http://images2.wikia.nocookie.net/joeplayground/images/9/99/CastleAge320.jpg,"Castle Age Wiki is the resource database for the Facebook-based game developed by Phoenix Age. The wiki provides information on updated news about Castle Age, gameplay information, quests, characters, and strategy guides.  ",,,,,
,Minecraft Buildcraft Wiki,minecraftbuildcraft.wikia.com,Video Games,http://images1.wikia.nocookie.net/joeplayground/images/9/9e/MinecraftBuildcraft320.jpg,"Buildcraft Minecraft Wiki is dedicated to the buildcraft feature in the popular Minecraft game. Buildcraft is a full featured modification (""mod"") for Minecraft that adds automated building, mining and crafting as well as pipe transport and item sorting to the Minecraft experience.",,,,,
,Xenoblade Wiki,xenoblade.wikia.com,Video Games,http://images2.wikia.nocookie.net/joeplayground/images/e/e6/Xenoblade320.jpg,"Xenoblade Wiki is a collaborative effort to gather relevant information about everything related to the Xenoblade game.  Xenoblade Chronicles, known in Japan as Xenoblade, is a role-playing video game published by Nintendo and developed by Monolith Soft for the Wii console. The wiki contains information on Xenoblade lore, characters, weapons, gameplay, and music in the game.  ",,,,,
,Mount and Blade Wiki,mountandblade.wikia.com,Video Games,http://images2.wikia.nocookie.net/joeplayground/images/f/fb/MountAndBlade320.jpg,"Mount & Blade Wiki is an encyclopedia about Mount & Blade, a medieval single-player action role-playing game for Windows developed by TaleWorlds. The wiki highlights features from the game such as lore, characters, weapons, and gameplay guides.  The wiki uses forums for specific help on game guides and cheats.  ",,,,,
,Xenopedia,avp.wikia.com,Entertainment,http://images1.wikia.nocookie.net/joeplayground/images/9/97/AlienVsPredator320.jpg,"Xenopedia is a database for all Aliens, Predators, and Aliens vs. Predators crossover films, graphic novels, and related materials.  It has over 1000 articles on alien species, theories, and characters pertaining to the Aliens universe, including the upcoming film: Prometheus.  ",,,,,
,How I Met Your Mother Wiki,how-i-met-your-mother.wikia.com,Entertainment,http://images1.wikia.nocookie.net/joeplayground/images/b/b5/HIMYM320.jpg,"How I Met Your Mother Wiki is the authoritative resource on the popular CBS sitcom How I Met Your Mother, which revolves around five 30-something characters in New York and the main character, Ted's quest to find his true love.  The wiki features character pages, episode portals, theories about ""The Mother"" and pages on viral promotions such as Barney's Blog.",,,,,
,Once Upon a Time Wiki,onceuponatime.wikia.com,Entertainment,http://images2.wikia.nocookie.net/joeplayground/images/e/e6/OnceUponATime320.jpg,"Once Upon a Time Wiki is a collaborative project on the new ABC series Once Upon a Time.  The series straddles the supernatural world of familiar fairy tale characters and their real-life counterparts in Storybrooke.  As such, the wiki also separates their fairy tale characters from their parallel real life characters in the series, as well as including trivia, episode pages, and the latest news.",,,,,
,Regular Show Wiki,regularshow.wikia.com,Entertainment,http://images1.wikia.nocookie.net/joeplayground/images/9/99/RegularShow320.jpg,"Regular Show Wiki is the ultimate resource for everything related to Regular Show, currently airing on Cartoon Network.  The wiki features pages not only on characters and episodes but also popular merchandise related to the series as well as in-universe references between other Cartoon Network series. ",,,,,
,Clash of the Dragons Wiki,clashofthedragons.wikia.com,Video Games,http://images1.wikia.nocookie.net/joeplayground/images/6/66/ClashOfTheDragons320.jpg,"Clash of the Dragons Wiki contains information on the popular Facebook CCG, from 5th Planet Games.  Free to play, the game features special options and items become available with the purchase and use of a currency known as Dragon Coins with real-world money.  The wiki provides information on card sets and types, missions, and game modes.",,,,,
,Devil May Cry Wiki,devilmaycry.wikia.com,Video Games,http://images3.wikia.nocookie.net/joeplayground/images/5/5c/DevilMayCry320.jpg,"The Devil May Cry Wiki is a comprehensive database about the Devil May Cry video game series, an action-adventure game created by Capcom which details the exploits of Dante, a half-human, half-demon vigilante who hunts and kill demons in order to save the Human World from their treacherous attacks.",,,,,
,Disgaea Wiki,disgaea.wikia.com,Video Games,http://images3.wikia.nocookie.net/joeplayground/images/1/12/Disgaea320.jpg,"Disgaea Wiki focuses on the on the Disgaea game series of SRPGs created and published by Nippon Ichi. The series is known for its unique setting, humour and high focus on level grinding, jobs and stat growth. Each of the games explores the Netherworld, realm of demons; Celestia, the abode of Angels; and Earth, the home of humans.",,,,,
,Aselia Wiki,aselia.wikia.com,Video Games,http://images1.wikia.nocookie.net/joeplayground/images/3/39/Aselia320.jpg,"Aselia Wiki is a comprehensive encyclopedia that covers the storylines, characters, and locations of every game in the series. This site also exists as a translation resource for information such as arte, title, and equipment data for every character's appearance in each game.",,,,,
,S.T.A.L.K.E.R. Wiki,stalker.wikia.com,Video Games,http://images1.wikia.nocookie.net/joeplayground/images/8/80/Stalker320.jpg,"S.T.A.L.K.E.R. Wiki is a community that aims to create the best resource for S.T.A.L.K.E.R.: Shadow of Chernobyl, S.T.A.L.K.E.R.: Clear Sky, and S.T.A.L.K.E.R.: Call of Pripyat. The wiki contains over 1000 pages of information on gameplay, lore, universe, weapons, and characters. ",,,,,
,Angry Birds Wiki,angrybirds.wikia.com,Video Games,http://images3.wikia.nocookie.net/joeplayground/images/e/e5/AngryBirds320.jpg,"Angry Birds Wiki is devoted to the popular mobile game application Angry Birds. It focuses on the story of a group of birds whose eggs are stolen by pigs. They pursue the pigs using their unique powers and destroy their defense structures. The objective of the game is, using the birds as projectiles, launching them at the fortresses of the pigs, bringing them down and defeating them, in turn regaining their eggs. The wiki has information about the game, the birds, and also cross-promotional Angry Birds games. ",,,,,
,Supernatural Wiki,supernatural.wikia.com,Entertainment,http://images1.wikia.nocookie.net/joeplayground/images/e/ed/Supernatural320.jpg,"Supernatural Wiki is a community site devoted to the Supernatural series from CW.  Supernatural is an on-going series about the Winchester brothers and their attempts to fight paranormal evils of the world.  The wiki covers information on characters, episodes, and theories, as well as demonic/fantasy species and objects seen in Supernatural.  ",,,,,
,Grimm Wiki,grimm.wikia.com,Entertainment,http://images2.wikia.nocookie.net/joeplayground/images/e/e3/Grimm320.jpg,"Grimm Wiki is a fan-built encyclopedia dedicated to the supernatural/paranormal series on CBS.  The series revolves around the modern Brothers Grimm solving crimes of supernatural nature.  The wiki focuses on articles about characters, episodes, ""wesens,"" and fantasy objects that appear in the series.  ",,,,,
,House Wiki,house.wikia.com,Entertainment,http://images1.wikia.nocookie.net/joeplayground/images/4/4c/House320.jpg,"House Wiki is the collaborative database about the popular medical FOX series: House, M.D, which ended its eighth season and series run in May 21, 2012 with 177 episodes.  The wiki currently has over 2000 pages on past House teams, current members, House's contentious relationships, patients, episodes, and medical cases.  ",,,,,
,IcarusPedia,kidicarus.wikia.com,Video Games,http://images4.wikia.nocookie.net/joeplayground/images/8/85/KidIcarus320.jpg,"Kid Icarus Wiki ""IcarusPedia"" is a collaborative encylopedia about the video game Kid Icarus. The storyline has elements from Greek mythology and features Pit as the protagonist, who can ""jump like Mario, collect items like Link and shoot things like Samus."" The wiki contains information about gameplay, characters, paraphernalia, and also fanon.  ",,,,,
,Recipes Wiki,recipes.wikia.com,Lifestyle,http://images4.wikia.nocookie.net/joeplayground/images/9/93/Recipes320.jpg,"Recipes Wiki is a giant collaborative database dedicated to recipes on everything from appetizers to desserts.  An online recipe book that anyone can use, edit, and contribute to, Recipes Wiki provides helpful tips on holiday cooking, popular cooking shows, and functions as the Recipes Hub for Wikia's other recipe-based wikis such as Healthy Recipes, Family Recipes, Gluten-Free Recipes, and more.  ",,,,,
,Gossip Girl Wiki,gossipgirl.wikia.com,Entertainment,http://images1.wikia.nocookie.net/joeplayground/images/a/ac/GossipGirl320.jpg,"Gossip Girl Wiki is a fanbase for the Gossip Girl books, the spin-off the It Girl novels, and popular CW series of the same name.  The wiki provides information on various romantic pairings, popularly known as ""ships,"" of the Upper East Side world of Gossip Girl, as well as the latest scandals, frenemies, theories and gossip about the characters.  ",,,,,
