,Wiki name,Wiki URL,Vertical,Primary image,Description,Secondary image 1,Secondary image 2,Secondary image 3,Secondary image 4,Secondary image 5
,True Blood Wiki,trueblood.wikia.com,Entertainment,http://images4.wikia.nocookie.net/joeplayground/images/a/a0/TrueBlood320.jpg,"True Blood Wiki is a database for HBO series, True Blood, based on Charlaine Harris's Southern Vampire Mysteries. Set in Bon Temps, Lousiana, the series explores the possibilities of vampires and the social implications of what it would mean if their existence were revealed to the general public, along with other supernatural presence such as fairies and ""weres.""",,,,,
,AliceSoft Wiki,alicesoft.wikia.com,Video Games,http://images1.wikia.nocookie.net/joeplayground/images/c/cc/AliceSoft320.jpg,"AliceSoft Wiki is a fanbase for Alice Soft (also known as AliceSoft) an eroge publisher for the computer market established in 1989, first for the PC-88 and PC-98, and later for PCs running Microsoft Windows platforms. The wiki offers information about all of the company's releases, old and new. ",,,,,
,Nintendo Wiki,nintendo.wikia.com,Video Games,http://images2.wikia.nocookie.net/joeplayground/images/f/f6/Nintendo320.jpg,"Nintendo Wiki is the gateway to information on everything Nintendo - from the NES and the original Game Boy to the Wii U and the Nintendo 3DS. A hub for all games and things Nintendo, Nintendo Wiki has portals to Mario, Pokemon, Legend of Zelda, and more with extensive gameplay information.",,,,,
,The Amazing World of Gumball Wiki,theamazingworldofgumball.wikia.com,Entertainment,http://images1.wikia.nocookie.net/joeplayground/images/1/12/Gumball320.jpg,"The Amazing World of Gumball Wiki is a collaborative effort about The Amazing World of Gumball (sometimes referred to simply as Gumball), a British animated television series that airs on Cartoon Network. The wiki contains information about characters, episodes, and features weekly trivia about the series. ",,,,,
,NWNWiki,nwn.wikia.com,Video Games,http://images2.wikia.nocookie.net/joeplayground/images/3/3a/NWN320.jpg,"Neverwinter Nights is an encyclopedia of information about Neverwinter Nights (NWN), a fantasy roleplaying computer game from BioWare, based on the third edition rules of Dungeons & Dragons (D&D). With this game, BioWare strove to raise the bar on their reputation for commitment to rich and evocative storytelling and an eye for detail. They also had a goal of providing official campaigns drawing players into epic and unforgettable tales of faith, war, and betrayal set in the Forgotten Realms.",,,,,
,InuYasha Wiki,inuyasha.wikia.com,Entertainment,http://images4.wikia.nocookie.net/joeplayground/images/c/ce/InuYasha320.jpg,"Inuyasha Wiki is dedicated to the long-running popular manga and anime series, Inuyasha. InuYasha is a shōnen action adventure romantic comedy, with elements from the horror genre. The wiki has nearly 1000 pages of information on Inuyasha series, characters, and franchise paraphernalia. ",,,,,
,Wakfu Wiki,wakfu.wikia.com,Video Games,http://images2.wikia.nocookie.net/__cb20120530212761/joeplayground/images/e/e5/Wakfu320.jpg,"Wakfu Wiki is a community collaboration about Wakfu, a turn-based tactical MMORPG under development by Ankama Studio. It takes place in the same fantasy world as Dofus, 1000 years later. Wakfu is a cross-media world. A number of projects, some completed, some in development, will all converge upon one single narrative, based in the world of Wakfu.",,,,,
,Naruto Fanon Wiki,narutofanon.wikia.com,Entertainment,http://images2.wikia.nocookie.net/__cb20120530212738/joeplayground/images/9/99/NarutoFanon320.jpg,"Naruto Fanon Wiki is dedicated to fanon/fanfiction about Naruto, the popular manga and anime series. In their own words, Naruto Fanon Wiki strives to become the best and largest Naruto Fanon fanbase in the world and has over 12000 pages worth of content.  ",,,,,
,Terminator Wiki,terminator.wikia.com,Entertainment,http://images1.wikia.nocookie.net/__cb20120530212761/joeplayground/images/4/43/Terminator320.jpg,"Terminator Wiki is a collaborative encyclopedia for everything related to the Terminator franchise of movies, TV series, novels, comics, video games, etc. The Terminator Wiki has comprehensive data on all featured Terminators across all universes as well as a characters in their respective timelines from movies, TV series, and novels.",,,,,
,The Creature Wiki,thecreatures.wikia.com,Lifestyle,http://images3.wikia.nocookie.net/__cb20120530212737/joeplayground/images/f/fc/Creatures320.jpg,"The Creature Wiki is dedicated to ""Creatures,"" a term created during the filming of a machinima series Robot Donkey Chronicles in Call Of Duty 4. The Creature Hub is the official site of the Creatures that was started in March of 2011. The Creature Hub contains the official Creature forums, the Creature Talk livestream, and the iTunes link for the podcast.",,,,,
,Monday Night Combat Wiki,mondaynightcombat.wikia.com,Video Games,http://images3.wikia.nocookie.net/__cb20120530212738/joeplayground/images/e/ed/MNC320.jpg,"Monday Night Combat Wiki is a collaborative website about Uber Entertainment's popular Monday Night Combat and Super Monday Night Combat games. Monday Night Combat for Xbox Live Arcade and Steam is an award nominated, class-based, third-person shooter and the most popular lethal sport of the future! It blends intense combat, finishing moves, and gameshow-like challenges and rewards to produce an action experience unlike any other. ",,,,,
,Magic: The Gathering Wiki,mtg.wikia.com,Video Games,http://images1.wikia.nocookie.net/__cb20120530212738/joeplayground/images/9/90/Magic320.jpg,"Magic: The Gathering Wiki is dedicated to ""The Gathering"" (colloquially Magic or MTG), a collectible card game created by mathematics professor Richard Garfield and introduced in 1993 by Wizards of the Coast. Magic is the first example of the modern collectible card game genre and still thrives today, with an estimated six million players in over seventy countries. ",,,,,
,Ace Attorney Wiki,aceattorney.wikia.com,Video Games,http://images3.wikia.nocookie.net/__cb20120530212737/joeplayground/images/e/e1/AceAttorney320.jpg,"Ace Attorney Wiki is an encyclopedia for Ace Attorney (called Gyakuten Saiban (meaning ""Turnabout Trial"") and Gyakuten Kenji (meaning ""Turnabout Prosecutor""), a meta-series of primarily text-adventure video games created by Shu Takumi and published by Capcom. These games follow various lawyers in their battles in the courtroom and their investigations of crime scenes.",,,,,
,RAGE Wiki,rage.wikia.com,Video Games,http://images1.wikia.nocookie.net/__cb20120530212739/joeplayground/images/0/01/Rage320.jpg,"RAGE Wiki is a community databse for Rage (stylized as RAGE), a first-person shooter and racing game developed by id Software, and published by Bethesda Softworks. The game takes place in a post-apocalyptic world similar to that of other popular video games such as Fallout and Borderlands. In an interview with GameSpot, designer Tim Willits revealed that the game is set in the near future following the impact of 99942 Apophis.",,,,,
,Darksiders Wiki,darksiders.wikia.com,Video Games,http://images4.wikia.nocookie.net/__cb20120530212738/joeplayground/images/d/dd/Darksiders320.jpg,"The Darksiders Wiki is a collaborative encyclopedia for everything related to the Darksiders series. The Darksiders Series is a series of action-adventure games about the The Four Horsemen of the apocalypse, developed by Vigil Games and published by THQ.",,,,,
,Wiki 24,24.wikia.com,Entertainment,http://images4.wikia.nocookie.net/joeplayground/images/3/31/24-320.jpg,"Wiki 24 is a database for the long-running, popular series 24. The show, starring Kiefer Sutherland as Jack Bauer, focuses on the efforts of the fictional Counter Terrorist Unit in Los Angeles, in its eighth season in New York, and in its seventh season, the FBI in Washington, D.C.. Each episode takes place over the course of one hour, depicting events ""as they occur"" in real time; a full season of twenty-four episodes thus covers a full day.",,,,,
,Wiggles Wiki,wiggles.wikia.com,Entertainment,http://images3.wikia.nocookie.net/__cb20120530212802/joeplayground/images/3/35/Wiggles320.jpg,"WikiWiggles is a database for The Wiggles, a children's music group that formed in 1991. The Wiggles have released close to fifty albums and video's and toured relentlessly, not just in Australia, but in the USA, Canada, Europe, Asia and many other places. They have one numerous amounts of awards and have been named the most successful children's act of all time.",,,,,
,White Wolf Wiki,whitewolf.wikia.com,Video Games,http://images4.wikia.nocookie.net/__cb20120530212761/joeplayground/images/0/07/WhiteWolf320.jpg,"The White Wolf Wiki is a collaborative encyclopedia project where you can find out about the worlds and systems created by White Wolf, the producer of many roleplaying games, board games, card games, novels and more. The wiki regularly updates their content with latest and upcoming releases for all White Wolf games.  ",,,,,
,Pretty Little Liars Wiki,pretty-little-liars.wikia.com,Entertainment,http://images4.wikia.nocookie.net/__cb20120530212738/joeplayground/images/a/a3/PrettyLittleLiars320.jpg,"Pretty Little Liars Wiki is a community fansite dedicated to Sara Shepard's Pretty Little Liars book series and the TV adaptation on ABC Family. The series follows the lives of four teenage girls: Aria Montgomery, Emily Fields, Hanna Marin, and Spencer Hastings, whose clique falls apart after the disappearance of their leader, Alison DiLaurentis. ",,,,,
,Scrubs Wiki,scrubs.wikia.com,Entertainment,http://images1.wikia.nocookie.net/__cb20120530212760/joeplayground/images/4/49/Scrubs320.jpg,"Scrubs Wiki is a community encyclopedia about the popular medical series, Scrubs. Scrubs Wiki boasts a comprehensive Scrubs episode guide, detailed information on all nine seasons and biographies on the entire Scrubs cast and crew, as well in-depth articles on the Scrubs characters in addition to fun facts such as comprehensive list of fantasies from J.D.'s wacky imagination. ",,,,,
,Air Gear Wiki,airgear.wikia.com,Entertainment,http://images2.wikia.nocookie.net/__cb20120530212737/joeplayground/images/3/31/AirGear320.jpg,"Air Gear is a community database for Air Gear, a shōnen manga written and illustrated by Oh! Great as well as anime adaptation. Air Gear is about the life of Itsuki Minami ""Ikki"", (also known as ""Baby Face"" and ""Lil (Little) Crow"") and his friends.  The manga is still running. ",,,,,
,Toriko Wiki,toriko.wikia.com,Entertainment,http://images2.wikia.nocookie.net/joeplayground/images/f/fe/Toriko320.jpg,"Toriko Wiki is a community wiki about Toriko manga, anime, and light novels. In a world where the taste and texture of food is extremely important, there exist individuals known as Gourmet Hunters, who specialize in the acquisition of rare ingredients and animals. Toriko is one of these hunters and it is his dream to find the most precious foods in the world and create the ultimate dinner course.",,,,,
,Amnesia: The Dark Descent Wiki,amnesia.wikia.com,Video Games,http://images4.wikia.nocookie.net/joeplayground/images/a/af/Amnesia320.jpg,"Amnesia Wiki is dedicated to Amnesia: The Dark Descent, a first person survival horror game. The wiki is dedicated to providing as much information as possible about the game, from gameplay and locations, to items and triggers (events and/or actions that will spawn monsters).",,,,,
,Sonic Fanon Wiki,sonicfanon.wikia.com,Video Games,http://images1.wikia.nocookie.net/joeplayground/images/b/ba/SonicFanon320.jpg,"Sonic Fanon WIki is a fanfiction wiki for Sonic stories featuring a lot of 100% original characters that look completely different from those created by SEGA. Driven by the popularity of SEGA's popular game and character, Sonic Fanon Wiki creates high quality work with original characters, gameplay, roleplay, locations, and more. ",,,,,
,Acepedia,acecombat.wikia.com,Video Games,http://images3.wikia.nocookie.net/joeplayground/images/1/15/AceCombat320.jpg,"Ace Combat Wiki is a comprehensive fanbase about Ace Combat series, an arcade-like flight simulation franchise created and owned by Namco Bandai Games (previously Namco). The series uses real-life actual or prototype planes in their games. Currently, there are sixteen games released in the franchise.",,,,,
,Hetalia Archives,hetalia.wikia.com,Entertainment,http://images1.wikia.nocookie.net/joeplayground/images/d/d2/Hetalia320.jpg,"Hetalia Archives Wiki strives to provide the most updated and comprehensive information about Axis Powers Hetalia, a webcomic, later adapted as a manga and an anime series, by Hidekaz Himaruya. The series presents an allegorical interpretation of political and historic events, particularly of the World War II era, in which the various countries are represented by anthropomorphic characters.",,,,,
,Death Note Wiki,deathnote.wikia.com,Entertainment,http://images3.wikia.nocookie.net/joeplayground/images/0/0b/DeathNote320.jpg,"Death Note Wiki is a community database about Death Note manga, which centers around a high school student named Light Yagami who discovers a supernatural notebook that allows him to kill anyone by writing the victim's name while picturing his or her face.",,,,,
,Marvel vs. Capcom Wiki,marvelvscapcom.wikia.com,Video Games,http://images3.wikia.nocookie.net/joeplayground/images/9/92/MarvelVsCapcom320.jpg,"Marvel vs. Capcom Wiki is a collective database for characters and games in Marvel vs. Capcom, a series of fighting games created by Capcom featuring Marvel and Capcom crossovers. The wiki offers information on all Marvel vs. Capcom games such as  X-Men: Children of the Atom, Marvel Super Heroes, X-Men vs. Street Fighter, Marvel Super Heroes vs. Street Fighter and more. ",,,,,
,Inheriwiki,inheritance.wikia.com,Entertainment,http://images2.wikia.nocookie.net/joeplayground/images/8/8e/Inheriwiki320.jpg,"Inheritence (InheriWiki) Wiki is dedicated to The Inheritance Cycle (previously known as the Inheritance Trilogy), a series of high-fantasy novels by homeschooled author Christopher Paolini. The series follows the exploits of Eragon, a teenage orphan who becomes the first of a new order of Dragon Riders.",,,,,
,.hack Wiki,dothack.wikia.com,Video Games,http://images2.wikia.nocookie.net/joeplayground/images/5/55/DotHack320.jpg,"dothack//Wiki (or "".hack//Wiki"") is a Wikia information site for all the known dothack universal series created by the company group ""CyberConnect2 Japan."" dothack//Wiki was created because of the difficulties to find updated information of all the mass dothack eras. dothack//Wiki is now available in English, Japanese, Spanish and Polish.",,,,,
,Dragon Quest Wiki,dragonquest.wikia.com,Video Games,http://images2.wikia.nocookie.net/__cb20120606214232/joeplayground/images/6/65/DragonQuest320.jpg,"Dragon Quest Wiki is devoted to Dragon Quest, a series of role-playing games made by Square Enix (originally Enix Co.) for a variety of video game platforms. It is the all-time best-selling video game series in Japan. Every Dragon Quest game is told primarily through the eyes a Hero named by the player, usually a prophesied ""Chosen One"" or a similar concept that requires him to rise against a new evil. ",,,,,
,Kingdoms of Camelot Wiki,koc.wikia.com,Video Games,http://images1.wikia.nocookie.net/__cb20120606214234/joeplayground/images/0/0b/KingdomsOfCamelot320.jpg,"Kingdoms of Camelot Wiki is dedicated to Kingdoms of Camelot, an Internet browser enabled game accessible through Facebook. A common abbreviation is KoC. In KoC players build up cities with armies which they can then use to attack Barbarian Camps, Wildernesses or other players. ",,,,,
,James Cameron's Avatar Wiki,james-camerons-avatar.wikia.com,Entertainment,http://images2.wikia.nocookie.net/__cb20120606214233/joeplayground/images/c/cd/JCAvatar320.jpg,"James Cameron's Avatar Wiki is a community that aims to create the best resource for the Avatar series of movies, and the universe they take place in. Avatar is a science fiction film written and directed by James Cameron, starring Sam Worthington, Zoë Saldaña, Stephen Lang, Michelle Rodriguez, and Sigourney Weaver and the highest grossing movie of all time. ",,,,,
,The World Ends With You Wiki,twewy.wikia.com,Video Games,http://images3.wikia.nocookie.net/__cb20120606214234/joeplayground/images/2/29/TWEWY320.jpg,"The World Ends With You Wiki is a database for The World Ends with You, known in Japan as It's a Wonderful World (すばらしきこのせかい Subarashiki Kono Sekai) is an action RPG for the Nintendo DS video game handheld. It was developed by the Kingdom Hearts team, Square Enix, and Jupiter.",,,,,
,D.Gray-man Wiki,dgrayman.wikia.com,Entertainment,http://images3.wikia.nocookie.net/__cb20120606214232/joeplayground/images/3/39/DGrayMan320.jpg,"D.Gray-man Wiki, is a growing resource of information for the D.Gray-man series by Katsura Hoshino. D.Gray-man is an ongoing Japanese manga series about a boy named Allen Walker, a member of an organization of Exorcists who makes use of an ancient substance called Innocence to combat the Millennium Earl and his demonic army of akuma.",,,,,
,Wikiality,wikiality.wikia.com,Entertainment,http://images3.wikia.nocookie.net/__cb20120606214234/joeplayground/images/8/86/Wikiality320.jpg,"Wikiality Wiki is dedicated to political satire from the popular The Colbert Report and Stephen Colbert. Stephen Colbert first used the the term Wikiality on the Monday, July 31, 2006 edition of The Colbert Report news program. Wikiality represents ""A reality where, if enough people agree with a notion, it becomes the truth."" Wikiality is generally believed to be a portmanteau of the words ""Wikipedia"" and ""reality"".",,,,,
,Agarest Wiki,agarest.wikia.com,Video Games,http://images2.wikia.nocookie.net/__cb20120606214232/joeplayground/images/3/3b/Agarest320.jpg,"Agarest Wiki is a database for the video games series Record of Agarest War, also known as Agarest: Generations of War, an SRPG on the PS3 and Xbox 360 by Compile Heart, RED Entertainment and Idea Factory. The wiki offers information on gameplay, strategy, characters, walkthroughs, and more",,,,,
,Civilization Wiki,civilization.wikia.com,Video Games,http://images1.wikia.nocookie.net/__cb20120606214232/joeplayground/images/3/39/Civilization320.jpg,"Civilization Wiki is a community source for Civilization, the series of turn-based strategy computer games designed largely by Sid Meier and various sequels and spinoffs. The wiki contains not only information about Civilization -Civilization V but also Sid Meier's various spin-offs such as Colonization and Call to Power.",,,,,
,Tribes Wiki,tribes.wikia.com,Video Games,http://images2.wikia.nocookie.net/joeplayground/images/9/96/Tribes320.jpg,"Tribes Wiki is a source for the game series Tribes is, a science fiction first-person shooter computer games originally developed by Dynamix, a subsidiary of Sierra Entertainment. Set in the same universe as the game Starsiege, there are six games in the Tribes series. ",,,,,
,Corriepedia,coronationstreet.wikia.com,Entertainment,http://images1.wikia.nocookie.net/joeplayground/images/2/22/Corriepedia320.jpg,"Coronation Street ""Corriepedia"" Wiki is a database for the popular British and longest ever running series: Coronation Street. Set in the north of England, Coronation Street chronicles the professional and private lives of the residents of a backstreet in Weatherfield, a fictional suburb of Greater Manchester.",,,,,
,Huntik Wiki,huntik.wikia.com,Entertainment,http://images3.wikia.nocookie.net/joeplayground/images/7/73/Huntik320.jpg,"The Huntik Wiki contains information pertaining primarily to the Huntik: Secrets & Seekers television series, including cast and production, and the TCG Game. Huntik: Secrets & Seekers is an Italian-based, animated series which was created and directed by Iginio Straffi.",,,,,
,Futurama Wiki,futurama.wikia.com,Entertainment,http://images1.wikia.nocookie.net/joeplayground/images/8/8d/Futurama320.jpg,"Futurama is a community-run encyclopedia for the popular animated series, Futurama. Futurama is an American sitcom series creаted by Matt Groening and developed by Groening and David X. Cohen, is an animated television show that focuses on the lives of delivery boy Fry, Leela, and Bender in the futuristic 31st century.",,,,,
,Park Pedia,jurassicpark.wikia.com,Entertainment,http://images4.wikia.nocookie.net/joeplayground/images/8/80/ParkPedia320.jpg,"Jurassic Park ""ParkPedia"" Wiki is devoted to the popular Jurassic Park franchise, from the original novels to Steven Spielberg's popular films. It began in 1990 when Universal Studios bought the rights to the novel by Michael Crichton before it was even published. ",,,,,
,Wiksteria Lane,desperatehousewives.wikia.com,Entertainment,http://images1.wikia.nocookie.net/joeplayground/images/d/d3/DesperateHousewives320.jpg,"Desperate Housewives ""Wiksteria Lane"" Wiki is a collaborative encyclopedia for Desperate Housewives, a dramedy-mystery television series, created by Marc Cherry, which aired on ABC. The series is narrated by former housewife, Mary Alice Young, who narrates the dirty laundries of her neighbors and friends from omniscient heaven.  ",,,,,
,Café World Wiki,cafeworld.wikia.com,Video Games,http://images1.wikia.nocookie.net/joeplayground/images/3/31/CafeWorld320.jpg,"Café World Wiki is a resource for  the multiplayer restaurant simulation social network game created by Zynga. It launched in September 2009. Available on Facebook, players strive to become a master chef and build a food empire by completing catering orders.",,,,,
,Comic-Con Wiki,http://comic-con.wikia.com,Entertainment,http://images2.wikia.nocookie.net/joeplayground/images/2/2f/ComicCon480.jpg,"Heading to San Diego Comic-Con this year?  Whether you’re a newbie or a seasoned veteran, Comic-Con Wiki has the latest on panels, survivor’s guide to Comic-Con, and of course, the celebrities! Follow the Comic-Con action on the wiki, which will be chock full of interviews, panel reviews, and cosplay pictures.  We have all the tips and tricks to make your Con!",http://images2.wikia.nocookie.net/joeplayground/images/2/24/ComicCon-alt1.jpg,http://images3.wikia.nocookie.net/joeplayground/images/8/8f/ComicCon-alt2.jpg,,,
,Bloons Wiki,bloons.wikia.com,Video Games,http://images2.wikia.nocookie.net/joeplayground/images/9/96/Bloons480.jpg,"Bloons Wiki is a collaborative encyclopedia about Bloons (or Bloons 1), a single-player browser game (a flash game) about a monkey popping balloons. Many bloons have special powers. The popularity of the original Bloons game has led to sequels, spin-offs, and iPhone/iPad games. ",,,,,
,Toaru Majutsu no Index Wiki,toarumajutsunoindex.wikia.com,Entertainment,http://images3.wikia.nocookie.net/joeplayground/images/d/de/Toaru480.jpg,"Toaru Majutsu no Index Wiki contains nearly 1000 pages about Toaru Majutsu no Index, translated to A Certain Magical Index of Prohibited Books and shortened to A Certain Magical Index, is a Japanese light novel series written by Kazuma Kamachi and illustrated by Kiyotaka Haimura. The series is published by ASCII Media Works under their Dengeki Bunko imprint since April 2004. The light novel series has been adapted into an anime series.",,,,,
,Galaxy Online II Wiki,galaxyonlineii.wikia.com,Video Games,http://images4.wikia.nocookie.net/joeplayground/images/5/5e/GalaxyOnline480.jpg,"Galaxy Online II Wiki is a comprehensive wiki dedicated to Galaxy Online II, a Facebook game based heavily on strategy and luck. The object of the game is to become the best of the best. By completing Quests and Instances, you will gain the power and experience to become the mightiest in all the Galaxy.",,,,,
,MapleWiki,maplestory.wikia.com,Video Games,http://images1.wikia.nocookie.net/joeplayground/images/7/71/MapleStory480.jpg,"MapleStory Wiki serves only the latest English information from GlobalMS and the latest Korean information from KoreaMS. MapleStory is a free, two-dimensional, side-scrolling Massively Multiplayer Online Role-Playing Game developed by Wizet and distributed by various companies. The game takes place in the ""Maple World,"" which players must defend against monsters.",,,,,
,Patapedia,patapon.wikia.com,Video Games,http://images4.wikia.nocookie.net/joeplayground/images/8/82/Patapon480.jpg,"Patapon ""Patapedia"" Wiki is dedicated to the real time strategy game, Patapedia. Considered a hybrid of both music and Real Time Strategy games, Patapon is a PSP game which focuses on the control of an army of small, cyclopean creatures through a series of brightly-colored, silhouetted, 2D scenarios. Patapon focuses on the Patapons' war against the Zigotons and their search for Earthend.",,,,,
,Ben 10 Fan Fiction Wiki,ben10fanfiction.wikia.com,Entertainment,http://images2.wikia.nocookie.net/joeplayground/images/b/b8/Ben10FanFiction480.jpg,"Ben 10 Fanfiction Wiki is a collaborative fanon site dedicated to the popular series, Ben 10. The wiki has over 16,000 pages about Ben 10 episodes, series, aliens, Omnitrixes, and more. Affiliated with the Ben 10 Wiki, Ben 10 Fanfiction Wiki houses exclusively fanon content that highlights the most popular stories and fanfiction. ",,,,,
,The Lion King Wiki,lionking.wikia.com,Entertainment,http://images3.wikia.nocookie.net/joeplayground/images/5/59/LionKing480.jpg,"Lion King Wiki is a community database dedicated to Disney's popular animated film, Lion King. The Lion King is a 1994 American animated feature film produced by Walt Disney Feature Animation and released by Walt Disney Pictures, and the thirty-second animated feature in the Walt Disney Animated Classics, as well as the highest-grossing traditionally-animated film of all-time in North America.",,,,,
