Uploaded,Wiki name,Wiki URL,Vertical,Primary image,Description,Secondary image 1,Secondary image 2,Secondary image 3,Secondary image 4,Secondary image 5
,Star Wars: The Clone Wars Wiki,http://de.starwarstcw.wikia.com/,Entertainment,http://images2.wikia.nocookie.net/joeplayground/images/0/0e/Starwarsclonewarswiki.jpg,"In diesem Wiki findest du Informationen zu der Serie Star Wars: The Clone Wars. Es werden die Charaktere der Show vorgestellt, viele Geschichten über die Klone und deren Geschichte gesammelt.",,,,,
,Drawn Together Wiki,http://de.drawntogether.wikia.com/,Entertainment,http://images3.wikia.nocookie.net/joeplayground/images/0/02/Drawntogehter2.jpg,"Im Drawn Together Wiki wird alles über die Cartoonserie Drawn Together gesammelt, die auf MTV und Comedy Central läuft. Die Helden und Superhelden und deren Gegenspieler der Show unterhalten immer wieder mit abstrusen Geschichten und ach mit ihren Liedern.",,,,,
,Mega Man Wiki,http://de.megamanx.wikia.com/,Video Games,http://images3.wikia.nocookie.net/joeplayground/images/0/0a/MegaMan320.jpg,"Das Mega Man Wiki ist eine Sammlung zu allem rund um den blauen Roboter mit der Armkanone, sowohl die Serien die mit ihm gezeigt wurden, aber natürlich auch vorllaendingen DIe Spiele, auf den verschiedenen Plattformen.",,,,,
,Fussball Manager Xperts Wiki,http://de.fmx.wikia.com/,Video Games,http://images3.wikia.nocookie.net/joeplayground/images/0/0d/Fussballmanagerxpertwiki.jpg,"In diesem Wiki sammeln wir nützliche Informationen und Tipps zum Fussball Manager von EA Sports und du findest hier einen Einstieg ins FMX Wiki über die wesentlichen Bereiche des Spiels, wie z.B. Vereine, Taktiken, Mannschaften, Aufstellung und Transfermarkt",,,,,
,Big Time Rush,http://de.bigtimerush.wikia.com/,Entertainment,http://images2.wikia.nocookie.net/joeplayground/images/8/82/Bigtimerushwiki.jpg,"Herzlich willkommen im Big Time Rush Wiki, hier dreht sich alles um Big Time Rush,einer Serie um eine College Boy Band, die früher zusammen Hockey spielten. Die Serie läuft auf Nickelodeon und wir tragen hier alle Infos zusammen.",,,,,
,Bibi Blocksberg Wiki,http://de.bibi-blocksberg.wikia.com/,Entertainment,http://images4.wikia.nocookie.net/joeplayground/images/0/01/Bibiblocksbergwiki.jpg,"Willkommen im Bibi Blocksberg Wiki, dem Wiki zu allem rund um Bibi Blocksberg. Hier findest du Informationen zu Folgen, Hexensprüchen, zum Hexenbuch und vielem mehr. Du bist herzlich eingeladen neue Inhalte hinzuzufügen oder Inhalte zu bearbeiten.",,,,,
,American Dad & Family Guy Wiki,http://de.americandad-familyguy.wikia.com/,Entertainment,,... keine mischmasch wiki,,,,,
,Inazuma Eleven Wiki,http://de.socceryaroze.wikia.com/,Entertainment,,,,,,,
,Moorhuhn Wiki,http://de.moorhuhn.wikia.com/,Video Games,http://images1.wikia.nocookie.net/joeplayground/images/0/03/Moorhuhnwiki.png,,,,,,
,PotBS Wiki,http://de.potbs.wikia.com/,Video Games,keine Bilder,"Willkommen zum Pirates of the Burning Sea Wiki. Hier sammeln wir Informationen zu dem MMPORG Titel von Flying Lab Software und tragen alles zusammen, angefangen bei Schiffen, Städten, Wirtschaftsresourcen und die verschiedenen Charaktere. Viel Spass!",,,,,
,Suikoden Wiki,http://de.suikoden.wikia.com/,Video Games,http://images4.wikia.nocookie.net/joeplayground/images/9/93/Suikodenwiki.jpg,tbc : Die Suikoden-Wiki ist die deutsche Wissenssammlung zu allem rund um die Rollenspiel-Serie Suikoden von Konami,,,,,
,Breaking Bad Wiki,http://de.breakingbad.wikia.com/,Entertainment,http://images3.wikia.nocookie.net/joeplayground/images/4/4f/Breakingbadwiki.jpg,"Willkommen im Breaking Bad Wiki! Diese Seite behandelt die von Kritikern als ""die beste Sendung im Fernsehen"" gelobte Sendung Breaking Bad. Da dies ein Wiki ist kannst du Artikel bearbeiten und erstellen und Interessierten helfen, mehr über diese Serie zu wissen. ",,,,,
,Dungeon Defenders Wiki,http://de.dungeondefenders.wikia.com/,Video Games,http://images3.wikia.nocookie.net/joeplayground/images/0/0e/Dungeondefenderswiki.jpg,"Dies ist das Dungeon Defenders Wiki, für das Spiel Dungeon Defenders, ein von Trendy Entertainment entwickeltes Videospiel welches auf zwei bekannte Spielgenren basiert: Tower Defense und Online-Action-RPG. Hier werden Informationen zum Spiel zusammengetragen. Viel Spaß beim Mitmachen.",,,,,
,Fiesta-Online Wiki der MONSTER-AG,http://de.monsterag.wikia.com/,Video Games,kein vernünftiges bild,Das Fiesta-Online Wiki der MONSTER-AG ist eine deutschsprachige Wissenssammlung zu allem rund um das MMORPG Fiesta-Online. Hier erfahrt ihr alles über die Charaktere und die Welt in der sie leben. Möge die Welt Isyas euch wohlgesonnen sein!,,,,,
,Soul Calibur Wiki,http://de.soulcalibur.wikia.com/,Video Games,http://images4.wikia.nocookie.net/joeplayground/images/6/62/Soulcalibur320.jpg,Das SoulCalibur Wiki ist das deutschsprachige Internet-Kompendium nach Machart der Wikipedia zu allem rund um die Kampfspiel-Serie SoulCalibur. ,,,,,
,SAWrestling Wiki,http://de.sawrestling.wikia.com/,Entertainment,,WTF is this shit !?,,,,,
,Rappelz Wiki,http://de.rappelz.wikia.com/,Video Games,http://images2.wikia.nocookie.net/joeplayground/images/5/5d/Rappelz_Obsessionwiki.jpg,Willkommen im neuen deutschsprachigen Rappelz-Wiki. Ziel ist alle Informationen zum südkoreanischen MMORPG Rappelz zusammenzutragen und ein Nachschlagewerk für die Spieler zu bilden. Wir beziehen uns hier auf die deutsche Version des Spiels. Unterschiede in den Inhalten zu anderen Regionen sind daher nicht ausgeschlossen.,,,,,
,Forsaken World Wiki,http://de.forsakenworld.wikia.com/,Video Games,http://images4.wikia.nocookie.net/joeplayground/images/3/32/Forsakenworldswiki2.jpg,...,,,,,
,Attorneypedia,http://de.aceattorney.wikia.com/,Video Games,keine vernünftigen Bilder,...,,,,,
,How-To-Wiki,http://de.howto.wikia.com/,Lifestyle,keine vernünftigen Bilder,...,,,,,
,Devil May Cry,http://de.dmc.wikia.com/,Video Games,http://images1.wikia.nocookie.net/joeplayground/images/3/31/Devilmaycrywiki.jpg,"Devil May Cry ist ein Wiki zu allem rund um Devil May Cry! Wilkommen auf dem Devil May Cry Wiki. Wir berichten über das ganze Devil May Cry Universum. Wir würden uns freuen, wenn auch ihr, euer Wissen mit uns teilt. ",,,,,
,Harvest Wiki,http://de.harvestmoon.wikia.com/,Video Games,keine vernünftigen Bilder,...,,,,,
,ApplewarPictures Wiki,http://de.applewarpictures.wikia.com/,Entertainment,keine vernünftigen Bilder,...,,,,,
,Negipedia,http://de.negima.wikia.com/,Entertainment,,"Willkommen auf der Negipedia, dem deutschen Wiki rund um den Manga und Anime Mahou Sensei Negima und Magister Negi Magi. Hier werden die Charaktere der Serie vorgestellt und beschrieben. Wenn auch du Interesse an diesem Wiki hast, melde dich doch an und hilf uns, die Seite zu gestalten.",,,,,
,True Blood Wiki,http://de.trueblood.wikia.com/,Entertainment,http://images4.wikia.nocookie.net/joeplayground/images/a/a0/TrueBlood320.jpg,Das True Blood Wiki ist eine Datenbank für die HBO Serie die im Deutschen Fernsehen auf RTL2 läuft. Sie basiert auf Charlaine Harris's Buchserie über Sookie Stackhouse und handelt über Vampire deren Existenz der Menschheit bekannt gegeben wurde. in diesem Wiki werden ausführlich die Charaktere der Serie beschrieben.,,,,,
,Moonyverse,http://de.sailormoon.wikia.com/,Entertainment,http://images3.wikia.nocookie.net/joeplayground/images/c/c1/Moonyversewiki.jpg,...,,,,,
,Kim Possible Wiki,http://de.kimpossible.wikia.com/,Entertainment,http://images2.wikia.nocookie.net/joeplayground/images/0/0e/Kimpossiblewiki.jpg,"Willkommen im Kim Possible Wiki. Dieses Wiki ist eine öffentliche Webseite über die Serie Kim Possible, die jeder bearbeiten kann! Die vorhandenen Seiten beschreiben die Personen, Orte und skurrilen Gegenstände, mit denen die Teenie-Heldin Kim bei ihren Missionen zu tun hat.",,,,,
,Sternchen Wiki,http://de.sternchen.wikia.com/,Entertainment,,...,,,,,
,Guilty Crown Wiki,http://de.guiltycrown.wikia.com,Entertainment,,...,,,,,
,Ghibli Wiki,http://de.ghibli.wikia.com/wiki/,Entertainment,http://images3.wikia.nocookie.net/joeplayground/images/6/6b/Ghibliwiki.png,"Dieses Wiki sammelt und präsentiert die Werke von Studio Ghibli. Auch Charaktere und Hintergrundinformationen werden hier präsentiert. Wer mehr wissen will, kann die Hilfe- und Historyseite besuchen. Studio Ghibli ist ein bekannter Animationsstudios für Animes. Sehr bekannte Werke sind Prinzessin Mononoke und Chihiros Reise ins Zauberland.",,,,,