,Wiki name,Wiki URL,Vertical,Primary image,Description,Secondary image 1,Secondary image 2,Secondary image 3,Secondary image 4,Secondary image 5
,Wikitroid,metroid.wikia.com,Video Games,http://images1.wikia.nocookie.net/joeplayground/images/8/88/Metroid320.jpg,"Metroid Wiki ""Wikitroid"" is a  community-run database that aims to create the best resource for Metroid, a series of video games produced by Nintendo. The Metroid games chronicle the missions of bounty hunter Samus Aran in a science fiction setting which contains many similarities to the Alien film franchise. The wiki has nearly 3500 pages of content devoted to the game series. ",,,,,
,A Wheel of Time Wiki,wot.wikia.com,Entertainment,http://images1.wikia.nocookie.net/joeplayground/images/8/8e/WheelOfTime320.jpg,"Wheel of Time Wiki is a comprehensive resource for the epic fantasy novel series, The Wheel of Time, by Robert Jordan. The wiki contains over 5000 pages dedicated to the series, which currently spans 13 books in print and another on the way, now penned by Brandon Sanderson.  WOT Wiki featured detailed information on the plot, subplots, characters, and the complicated world of The Wheel of Time. ",,,,,
,Aion Wiki,aion.wikia.com,Video Games,http://images2.wikia.nocookie.net/joeplayground/images/c/c9/Aion320.jpg,"Aion Wiki is dedicated to becoming the best community resource for Aion, a massively multiplayer online role-playing game (MMORPG) released by NCsoft, a major Korean game developer. The wiki currently contains nearly 8000 articles on Aion gameplay, characters, news, classes, races, and more.  ",,,,,
,Uncyclopedia,uncyclopedia.wikia.com,Lifestyle,http://images1.wikia.nocookie.net/joeplayground/images/e/e7/Uncyclopedia320.jpg,"Uncyclopedia is an encyclopedia full of misinformation and lies. You might say it puts the ""psych!"" in ""encyclopedia."" You can make sense if you want to, be sarcastic if you want to, be dry or even informative. Everything goes.",,,,,
,My Little Pony Wiki,mlp.wikia.com,Entertainment,http://images1.wikia.nocookie.net/joeplayground/images/b/bb/MLP320.jpg,"My Little Pony ""Friendship is Magic"" Wiki is dedicated to the popular cult show ""My Little Ponies"" and the resulting paraphernalia.  The wiki sources information on not only the cast of ponies and the episodes, but also showcases the cultural effect of the series.  MLP Wiki is nothing if not comprehensive about the joy that My Little Ponies bring.  ",,,,,
,Kingdom Hearts Wiki,kingdomhearts.wikia.com,Video Games,http://images4.wikia.nocookie.net/joeplayground/images/6/66/KingdomHearts320.jpg,"Kingdom Hearts ""Le Keyhole: Ye Olde Kingdom Hearts Fansite"" Wiki is a fan-based Kingdom Hearts encyclopedia dedicated to the best information about the main Kingdom Hearts games and resulting remakes. Kingdom Hearts is a series of action role-playing games (RPG) developed and published by Square Enix. It is the result of a collaboration between Square and Disney Interactive Studios, featuring crossover of various Disney settings based in a universe made specifically for the series.",,,,,
,NWN2Wiki,nwn2.wikia.com,Video Games,http://images2.wikia.nocookie.net/joeplayground/images/d/d0/NWN2-320.jpg,"NWN2Wiki (Neverwinters Nights 2) Wiki is a database that curates information related to Neverwinters Nights 2, the sequel to Neverwinter Nights. It was developed by Obsidian and published by Atari with the assistance of NWN developer BioWare. The first expansion, Mask of the Betrayer, was released Oct 9th, 2007. The second expansion, Storm of Zehir, was released on November 18th, 2008. NWN2 is based on Dungeons and Dragons version 3.5, departing from the original NWN which was based on DnD 3.0.",,,,,
,Kamen Rider Wiki,kamenrider.wikia.com,Entertainment,http://images3.wikia.nocookie.net/joeplayground/images/3/3e/KamenRider320.jpg,"Kamen Rider Wiki has over 1000 pages dedicated to Kamen Riders, a weekly science fiction story created by Japanese manga artist Shotaro Ishinomori. It debuted as a tokusatsu television series on April 3, 1971 and ran until February 10, 1973, airing on the Mainichi Broadcasting System and NET TV (now TV Asahi). A manga adaptation was also featured in Shōnen Magazine around the same period. The series has spawned many sequels and evolved into a franchise.",,,,,
,Duel Masters Wiki,duelmasters.wikia.com,Video Games,http://images4.wikia.nocookie.net/joeplayground/images/f/f8/DuelMasters320.jpg,"Duel Masters Wiki has over 8000 pages of information on the Duel Masters franchise, including the manga, anime, video games and card game. The wiki strives to list every Card, Tip, Trivia, Gallery, Ruling, Type of Deck and Set Contents associated with the Trading Card Game ""Duel Masters,"" in both the TCG and OCG formats. ",,,,,
,Pirates of the Caribbean Encyclopedia,pirates.wikia.com,Entertainment,http://images4.wikia.nocookie.net/joeplayground/images/b/ba/POTC320.jpg,"Pirates of the Caribbean Wiki is a community database for Disney's Pirates of the Caribbean ride, which spawned the Pirates of the Caribbean film series as well as books, games, and toys.  The wiki has over 2000 pages dedicated to the colorful characters, fantastical locations, and all related Pirates of the Caribbean media.  ",,,,,
,Saint Seiya Wiki,saintseiya.wikia.com,Entertainment,http://images2.wikia.nocookie.net/joeplayground/images/b/b0/SaintSeiya320.jpg,"Saint Seiya Wik is dedicated to the popular manga and anime Saint Seiya, also known as Knights of the Zodiac. The original manga series written and illustrated by Masami Kurumada and serialized in Weekly Shōnen Jump from 1986 to 1991, and adapted into an anime TV series by Toei Animation from 1986 to 1989.",,,,,
,Alien Species Wiki,aliens.wikia.com,Entertainment,http://images1.wikia.nocookie.net/joeplayground/images/3/35/Aliens320.jpg,"Alien Species Wiki is a website containing information on any alien creature ever imagined by mankind, from Star Trek's Tribbles to Wayne Barlowe's Emperor Sea Striders. The wiki contains over 1000 pages dedicated to canon and non-canon alien species and is affiliated with Alien Fanon Wiki and Multiverses Wiki. ",,,,,
,Hunterpedia,hunterxhunter.wikia.com,Entertainment,http://images1.wikia.nocookie.net/joeplayground/images/1/14/HunterxHunter320.jpg,"Hunter x Hunter ""Hunterpedia"" Wiki is a collaborative database about the Japanese manga Hunter x Hunter, written and illustrated by Yoshihiro Togashi. The story focuses on a young boy named Gon, who discovers that his father, whom he was told was dead, is actually alive and well. The wiki contains 600 pages of information about the manga, anime, and characters.",,,,,
,Gagapedia,ladygaga.wikia.com,Entertainment,http://images2.wikia.nocookie.net/joeplayground/images/0/0e/Gagapedia320.jpg,"Lady Gaga ""Gagapedia"" Wiki is all about the pop culture phenomenon Lady Gaga.  The wiki is dedicated to providing the best and most updated information about Lady Gaga herself, her discography, and other business ventures such as Haus of Gaga, fashion, and online presence.  ",,,,,
,Doom Wiki,doom.wikia.com,Video Games,http://images1.wikia.nocookie.net/joeplayground/images/c/c6/Doom320.jpg,"Doom Wiki is a collaborative encyclopedia about id Software's classic games Doom and Doom II, as well as games based on the Doom engine. Doom is an iconic game that consolidated the first-person shooter genre. With a science fiction and horror style, it gives the players the role of marines who find themselves in the focal point of an invasion from hell. The game introduced deathmatch and cooperative play in the explicit sense, and helped further the practice of allowing and encouraging fan-made modifications of commercial video games.",,,,,
,A Song of Ice and Fire Wiki,iceandfire.wikia.com,Entertainment,http://images2.wikia.nocookie.net/joeplayground/images/0/08/IceAndFire320.jpg,"A Song of Ice and Fire Wiki is the sister wiki to its television counterpart, Game of Thrones Wiki. A Song of Ice and Fire Wiki provides information about George R.R. Martin's Game of Thrones saga and contains spoilers and information about the characters in the novels.",,,,,
,BlazBlue Wiki,blazblue.wikia.com,Video Games,http://images3.wikia.nocookie.net/joeplayground/images/9/94/BlazBlue320.jpg,"BlazBlue Wiki is dedicated to curating information about BlazBlue: Calamity Trigger and its subsequent spin-offs. BlazBlue is a 2D fighting game developed by Arc System Works which was available in arcades before both the Xbox 360 and PlayStation 3 versions. The wiki contains information about characters, game series, and related media",,,,,
,High School DxD Wiki,highschooldxd.wikia.com,Entertainment,http://images1.wikia.nocookie.net/joeplayground/images/c/c5/HighSchoolDxD320.jpg,"High School DxD Wiki is dedicated to everything about the light novel, manga, and anime series High School DxD created by Ichiei Ishibumi and Miyama-Zero. High School DxD began as a light novel but has since then branched out to manga and anime, currently being distributed by FUNimation.  ",,,,,
,Code Geass Wiki,codegeass.wikia.com,Entertainment,http://images1.wikia.nocookie.net/joeplayground/images/5/50/CodeGeass320.jpg,"Code Geass Wiki is a collaborative database about the popular anime and manga series Code Geass: Lelouch of the Rebellion created by Sunrise, directed by Gorō Taniguchi, and written by Ichirō Ōkouchi, with original character designs by Clamp. Code Geass Wiki has expanded to include spin-offs such as Code Geass: Akito The Exiled.  ",,,,,
,DC Animated Universe Wiki,dcanimated.wikia.com,Entertainment,http://images1.wikia.nocookie.net/joeplayground/images/1/15/DCAU320.jpg,"DC Animated Wiki is devoted to the DC Animated Universe. It provides extensive coverage of everything pertaining to the line of DC-based shows, which started with Batman: The Animated Series in 1992 and concluded with Justice League Unlimited in 2006.",,,,,
,Spartacus Wiki,spartacus.wikia.com,Entertainment,http://images4.wikia.nocookie.net/joeplayground/images/e/ed/Spartacus320.jpg,"Spartacus Wiki is a community about the iconic Spartacus film as well as the recent Starz series: Spartacus: Blood and Sand, Spartacus: Gods of the Arena, and Spartacus: Vengeance.  The wiki provides information about the fictional Roman slave character Spartacus as well as the supporting cast for his adventures in the series. ",,,,,
,BIONICLE Wiki,bionicle.wikia.com,Entertainment,http://images3.wikia.nocookie.net/joeplayground/images/8/82/Bionicle320.jpg,"BIONICLE Wiki is a hub of ""Wiki Metru,"" a large community centering about wikis about Bionicle. The Bionicle Wiki is touted as being the most accurate wiki for information about the Bionicle Wiki. Any canon information from Bionicle sources is included in the wiki along with Brickipedia, BIONICLE Reviews Wiki, Custom BIONICLE Wiki, HeroPedia, Custom Hero Factory Wiki.",,,,,
,Shaman King Wiki,shamanking.wikia.com,Entertainment,http://images3.wikia.nocookie.net/joeplayground/images/d/d3/ShamanKing320.jpg,Shaman King Wiki is a database for a shonen manga created by Hiroyuki Takei which was serialized in Weekly Shonen Jump from 1998 to 2004. Shaman King has also been adapted into an anime series.,,,,,
,Urban Rivals Wiki,urban-rivals.wikia.com,Video Games,http://images1.wikia.nocookie.net/joeplayground/images/9/90/UrbanRivals320.jpg,"Do you like trading card games and appreciate the comic book style of graphics?  You should check out Urban Rivals Wiki and get the scoop on this online TCG.  Learn about the game, the cards, booster packs and more.  ",,,,,
,ThunderCats Wiki,thundercats.wikia.com,Entertainment,http://images2.wikia.nocookie.net/joeplayground/images/4/46/ThunderCats320.jpg,"The Thundercats, led by the young Thundercat Lord Lion-O, are fighting evil on Third Earth.  Learn all about the new series, or check out the old series to find out where it all started.  ""Thundercats-Ho!""",,,,,
,SNK Wiki,snk.wikia.com,Video Games,http://images1.wikia.nocookie.net/joeplayground/images/c/c1/SNK320.jpg,"SNK, a Japanese video game hardware and software company, is most notable for creating the Neo-Geo arcade system, and several franchises of games including The King of Fighters, Metal Slug, Samurai Shodown and Fatal Fury.  Check out the wiki and learn about all of the games from SNK.",,,,,
,Ratchet & Clank Wiki,ratchet.wikia.com,Video Games,http://images3.wikia.nocookie.net/joeplayground/images/2/25/Ratchet320.jpg,"Come on an adventure with Ratchet & Clank Wiki.  We have all the information about the games, the characters, and the worlds they visit.  For instance, did you know that the Hoverboard Z3000 was the first item that Ratchet acquired in the original Ratchet & Clank?",,,,,
,Backyard Monsters Wiki,backyardmonsters.wikia.com,Video Games,http://images1.wikia.nocookie.net/joeplayground/images/1/19/BackyardMonsters320.jpg,"Backyard Monsters is a game created by Kixeye, where players create and manage a base filled with monsters in their backyard. This backyard is part of a larger world where many other players attack, defend, and build, all trying to create the greatest backyard empire. It can be seen as a mix of Desktop Tower Defense, Travian, and The Space Game.  Visit the wiki to find out everything you need to know to build your backyard empire!",,,,,
,Dead or Alive Wiki,deadoralive.wikia.com,Video Games,http://images4.wikia.nocookie.net/joeplayground/images/1/14/DeadOrAlive320.jpg,"Come figure out all the combos for your favorite characters on the Dead or Alive wiki.  Learn more about the back-stories for each of the characters as you battle your way to the top.  Will you end up Dead, or will you stay alive?  Increase your chances by visiting the wiki and checking out all the data on this game franchise.  ",,,,,
,Fantendo,fantendo.wikia.com,Video Games,http://images3.wikia.nocookie.net/joeplayground/images/8/88/Fantendo320.jpg,"Welcome to Fantendo, wiki of Nintendo fanon! Fantendo is where Nintendo fans create their own games, characters, fan-fiction, etc.  Have you ever thought you could improve on your favorite games, or wondered what it would be like to pit two unrelated characters against each other in battle?  Fantendo wiki is the place for you.",,,,,
,Moshi Monsters Wiki,moshimonsters.wikia.com,Video Games,http://images2.wikia.nocookie.net/joeplayground/images/d/d2/MoshiMonsters320.jpg,"The Moshi Monsters Wiki is an information resource about Moshi Monsters, a rapidly growing online game by Mind Candy.   Moshi Monsters is a virtual where anyone can adopt and care for their very own monster. Monster owners can customize, play with, and share their monster with friends.",,,,,
,Red vs. Blue Wiki,rvb.wikia.com,Entertainment,http://images1.wikia.nocookie.net/joeplayground/images/0/02/RedVsBlue320.jpg,"Red vs. Blue Wiki is a collaborative encyclopedia for Red vs. Blue (RvB), a machinima comic sci-fi video series. The Red vs. Blue Wiki hosts content about the characters, series, trivia, and news updates.  The wiki even has ""Speculation House"" about future Red vs. Blue storyline predictions.",,,,,
,Fallen Earth Wiki,fallenearth.wikia.com,Video Games,http://images2.wikia.nocookie.net/joeplayground/images/5/54/FallenEarth320.jpg,"Fallen Earth Wiki has nearly 10,000 pages on everything related to Fallen Earth, a science fiction MMORPG in development by Icarus Studios, LLC. The Fallen Earth story takes place in the 22nd century, in a post-apocalyptic world. In the ruins of old Earth the player encounters genetically altered beasts, advanced technology, and warring Factions.",,,,,
,Teen Titans Wiki,teentitans.wikia.com,Entertainment,http://images3.wikia.nocookie.net/joeplayground/images/9/9b/TeenTitans320.jpg,"Teen Titans Wiki is a database for Teen Titans, a popular children's animates series about the teenage versions of DC Comic's heroes such as Robin, Starfire, and Speedy. Teen Titans Wiki is also affiliated with Young Justice Wiki, another animated series about DC heroes that targets a younger audience.  ",,,,,
,McMMO Wiki,mcmmo.wikia.com,Video Games,http://images2.wikia.nocookie.net/joeplayground/images/2/21/McMMO320.jpg,"McMMO Wiki is dedicated to McMMO, an open source plugin for the Minecraft multiplayer server mod Bukkit that is currently under development by Nossr50. This plugin allows for an RPG-like experience to exist in the world of Minecraft complete with experience points, special powers, parties, PvP and more.",,,,,
,Animal Crossing City,animalcrossing.wikia.com,Video Games,http://images4.wikia.nocookie.net/joeplayground/images/d/d9/AnimalCrossing320.jpg,"Animal Crossing City is a collaborative encyclopedia for everything related to the Animal Crossing series. The Animal Crossing video game series is a series of communication adventure games exclusively for Nintendo consoles. The game is non-linear, in the sense that it has a somewhat set beginning, a middle, and no end. The player takes the role of a human in an village of animals.",,,,,
,Merlin Wiki,merlin.wikia.com,Entertainment,http://images2.wikia.nocookie.net/joeplayground/images/c/ca/Merlin320.jpg,"Merlin Wiki is a community-based encyclopedia about Merlin, the BBC reboot series about the early days King Arthur, the Knights of the Round Table, and Merlin.  Merlin Wiki prides themselves on being the #1 volunteer run information and fan base for Merlin with nearly 900 pages on characters, episodes, and featured location, weapons, mythical creatures and duels. ",,,,,
,American Dad Wiki,americandad.wikia.com,Entertainment,http://images1.wikia.nocookie.net/joeplayground/images/c/c2/AmericanDad320.jpg,"American Dad Wiki is a encyclopedia about Seth MacFarlane's hit animated series, American Dad! The wiki contains over 2000 pages on characters, episodes, Roger's disguises, news, musical numbers and American Dad paraphernalia.  ",,,,,
,Spore Wiki,spore.wikia.com,Video Games,http://images2.wikia.nocookie.net/joeplayground/images/e/e2/Spore320.jpg,"Spore Wiki is a knowledge database dedicated to Spore, the computer simulation video game developed by Will Wright.  Affiliated with Sims Wiki, also developed by Wright, Spore is innovative in technology of the game design, as well as the expansive range of sci-fi game play.",,,,,
,TERA Wiki,tera.wikia.com,Video Games,http://images1.wikia.nocookie.net/joeplayground/images/8/8c/TERA320.jpg,"TERA Wiki is an encylopedia about TERA: Exiled Realm of Arborea, a fantasy massively multiplayer online role-playing game, developed by Bluehole Studio and published by En Masse Entertainment in the US and Frogster Interactive in the EU. TERA has MMORPG features such as quests, crafting and player versus player action.",,,,,
,Godzilla Wiki,godzilla.wikia.com,Entertainment,http://images4.wikia.nocookie.net/joeplayground/images/1/12/Godzilla320.jpg,"Godzilla ""WikiZilla"" Wiki is all about ""Kaiju"" monsters, including the popular Godzilla and King Kong. Kaiju are typically modeled after conventional animals, insects or mythological creatures; however, there are more exotic examples, although popular convention usually associates it with monsters in Japanese cinema. ",,,,,
,Scoobypedia,scoobydoo.wikia.com,Entertainment,http://images2.wikia.nocookie.net/joeplayground/images/d/d3/Scoobypedia320.jpg,"Scooby-Do ""Scoobypedia"" Wiki is a free encyclopedia for all things Scooby-Do, from the popular children's animated series to the live-action film.  The wiki also has extensive information on Scooby-Do paraphernalia, characters, and all the monsters to ever appear on Scooby-Do.",,,,,
,Grand Chase Wiki,grandchase.wikia.com,Video Games,http://images3.wikia.nocookie.net/joeplayground/images/e/ea/GrandChase320.jpg,"Grand Chase Wiki is a collaborative database about Grand Chase, a free-to-play, two-dimensional side-scrolling MMORPG developed by the South Korean company KOG Studios. The story focuses on the adventure of the Grand Chase group originally by Elesis Lire and Arme, as the adventure goes on new characters join the team.",,,,,
,MUGEN Database,mugen.wikia.com,Video Games,http://images3.wikia.nocookie.net/joeplayground/images/0/05/MUGEN320.jpg,"The MUGEN Database lists characters, stages, etc. for use with the M.U.G.E.N fighting game engine.  M.U.G.E.N (also known simply as MUGEN) is a freeware 2D fighting game engine designed by Elecbyte.  The wiki contains information about characters, stages, projects, motifs, and more.",,,,,
,The Secret Circle Wiki,secretcircle.wikia.com,Entertainment,http://images4.wikia.nocookie.net/joeplayground/images/8/82/SecretCircle320.jpg,"The Secret Circle Wiki is a community-driven database about The Secret Circle novels and CW adaptation.  Written by the same author as the popular The Vampire Diaries, The Secret Circle Wiki is also affiliated with The Vampire Diaries Wiki and has all information related to characters, books, and TV series.  ",,,,,
,Mafia Wiki,mafiagame.wikia.com,Video Games,http://images3.wikia.nocookie.net/joeplayground/images/3/38/Mafia320.jpg,"Mafia Wiki is a database for Mafia and Mafia II, a third-person shooter video game initially made for PC and released in 2002. It was later made available for PlayStation 2 and Xbox in 2004. It was developed by a Czech based company Illusion Softworks. The game allows the player to take on the role of a criminal who has to accomplish various missions in order to advance in the game. It received strong critical reaction and continued to maintain a loyal cult following",,,,,
,Nerf Wiki,nerf.wikia.com,Entertainment,http://images2.wikia.nocookie.net/joeplayground/images/7/75/Nerf320.jpg,"Nerf Wiki strives to be a source of information for everything related to Nerfs, a popular line of toys developed by Hasbro. Most of the toys are a variety of foam-based weaponry, but there were also several different types of Nerf toys, such as balls for sports like football, basketball, and others. The most notable of the toys are the dart guns (referred to by Hasbro as ""blasters"") that shoot ammunition made from Nerf foam.",,,,,
,Uncharted Wiki,uncharted.wikia.com,Video Games,http://images3.wikia.nocookie.net/joeplayground/images/7/7a/Uncharted320.jpg,"Uncharted Wiki contains nearly 1500 pages on the Uncharted series and maintains their own Twitter account. Uncharted is a series of video games developed by the award-winning company Naughty Dog for the PlayStation 3. Each game revolves around the adventures of protagonist Nathan Drake; a modern-day treasure hunter and action pro, as he attempts to unearth various historical mysteries. ",,,,,
,Criminal Minds Wiki,criminalminds.wikia.com,Entertainment,http://images4.wikia.nocookie.net/joeplayground/images/b/bf/CriminalMinds320.jpg,"Criminal Minds Wiki is a database for Criminal Minds, the popular FBI procedural on CBS. Criminal Minds revolves around an elite team of profilers from the FBI's Behavioral Analysis Unit (BAU) at Quantico, Virginia. Profilers analyze the country's most twisted criminal minds. The wiki has information on not only the fictional criminals and characters but also their real-life counterparts.  ",,,,,
,Dawn of the Dragons Wiki,dotd.wikia.com,Video Games,http://images2.wikia.nocookie.net/joeplayground/images/0/03/DOTD320.jpg,"Dawn of the Dragons Wiki is a database of nearly 2000 pages about Dawn of the Dragons, a Facebook RPG application that utilizes the free-to-play business model.  The game, currently in open beta, was developed by 5th Planet Games. The wiki constantly updates information about daily rewards and limited edition items.",,,,,
,Avengers Alliance Wiki,avengersalliance.wikia.com,Video Games,http://images1.wikia.nocookie.net/joeplayground/images/1/17/AvengersAlliance320.jpg,"Avengers Alliance Wiki contains information about Marvel: Avengers Alliance, the Flash-based game for Facebook developed by Playdom, a subsidiary of The Walt Disney Company. The game was released in collaboration with the release of The Avengers, Marvel and Disney film.",,,,,
,Crysis Wiki,crysis.wikia.com,Video Games,http://images4.wikia.nocookie.net/joeplayground/images/6/6b/Crysis320.jpg,"Crysis Wiki is a collaborative encyclopedia for Crysis video game series, a science fiction first-person shooter video game series developed by Crytek and published by Electronic Arts. The series revolves around a group of military protagonists with ""nanosuits,"" technologically advanced suits of armor that allow them to gain enhanced physical strength, speed, defense, and cloaking abilities.",,,,,
,Kuroshitsuji Wiki,kuroshitsuji.wikia.com,Entertainment,http://images2.wikia.nocookie.net/joeplayground/images/d/da/Kuroshitsuji320.jpg,"Kuroshitsuji (Black Butler) Wiki is a community-run fanbase about the Kuroshitsuij manga, anime, and live action series.  Kuroshitsuji follows the adventures of Ciel Phantomhive, a young lord during the Victorian era who harbors a dark secret: a demon Black Butler who does his every bidding to consume Ciel's soul.",,,,,
,Madmen Wiki,madmen.wikia.com,Entertainment,http://images2.wikia.nocookie.net/joeplayground/images/c/cd/MadMen320.jpg,"Mad Men Wiki is a community database for the popular AMC series, Mad Men. Set in the advertising fast times of 1960s, Mad Men follows the lives of the ruthlessly competitive men and women of Madison Avenue advertising, an ego-driven world where key players make an art of the sell.",,,,,
,Age of Empires Wiki,ageofempires.wikia.com,Video Games,http://images2.wikia.nocookie.net/joeplayground/images/e/e8/AgeOfEmpires320.jpg,"Age of Empires Wiki is about the ""Age of Empires Series"", the history-based, original real time strategy games of Ensemble Studios published by Microsoft Game Studios. The wiki has information about all of the Age of Empire series as well as its spin-offs, Age of Mythology.",,,,,
