,Wiki name,Wiki URL,Vertical,Primary image,Description,Secondary image 1,Secondary image 2,Secondary image 3,Secondary image 4,Secondary image 5
,Zeldapedia,zelda.wikia.com,Video Games,http://images1.wikia.nocookie.net/joeplayground/images/1/13/Zelda320.jpg,"Zeldapedia's goal is to become the best source of information for Nintendo's Legend of Zelda series. Since its creation in 2005, Zeldapedia has grown into a large, community-based wiki and has been translated into several languages.",http://images2.wikia.nocookie.net/joeplayground/images/7/7c/Zelda2.jpg,http://images1.wikia.nocookie.net/joeplayground/images/c/cf/Zelda3.jpg,,,
,Yu-Gi-Oh! Wikia,yugioh.wikia.com,Entertainment,http://images3.wikia.nocookie.net/joeplayground/images/0/0a/Yugioh320.jpg,"Yu-Gi-Oh! Wikia is a database on Konami's Yu-Gi-Oh! franchise, containing information on the trading card game, official card game, deck types, board games, video games, animes, mangas, films and characters.",http://images2.wikia.nocookie.net/joeplayground/images/a/aa/Yugioh2.jpg,http://images1.wikia.nocookie.net/joeplayground/images/9/90/Yugioh3.jpg,,,
,WoWWiki,www.wowwiki.com,Video Games,http://images4.wikia.nocookie.net/joeplayground/images/7/77/WoWWiki320.jpg,"WoWWiki is a wiki dedicated to cataloging the Warcraft universe (with a focus, though not priority, on World of Warcraft); covering the entire Warcraft series of games, RPG reference books, strategy guides, novels, and comics.",http://images3.wikia.nocookie.net/joeplayground/images/8/89/WoWWiki2.jpg,http://images3.wikia.nocookie.net/joeplayground/images/7/7a/WoWWiki3.jpg,,,
,Wookieepedia,starwars.wikia.com,Entertainment,http://images1.wikia.nocookie.net/joeplayground/images/8/89/Wookieepedia320.jpg,"Wookieepedia is a wiki-based online encyclopedia that contains detailed information about the Star Wars universe, including movies, books, video games, characters, locations, technology, weapons, vehicles and everything in between.",http://images1.wikia.nocookie.net/joeplayground/images/9/94/Wookieepedia2.jpg,http://images3.wikia.nocookie.net/joeplayground/images/7/7f/Wookieepedia3.jpg,,,
,TibiaWiki,tibia.wikia.com,Video Games,http://images2.wikia.nocookie.net/joeplayground/images/e/e5/Tibia320.jpg,"With over 9,800 pages, at TibiaWiki you will find information for practically everything that exists in Tibia. Whether you are looking for text of a book, want to know how to obtain a certain item, or need hints for a quest, we've got you covered.",http://images4.wikia.nocookie.net/__cb20120508231214/joeplayground/images/a/ab/Tibia2.jpg,http://images2.wikia.nocookie.net/__cb20120508231214/joeplayground/images/b/b4/Tibia3.jpg,,,
,The Sims Wiki,sims.wikia.com,Video Games,http://images2.wikia.nocookie.net/joeplayground/images/1/1e/Sims320.jpg,"The Sims Wiki is devoted to The Sims series developed by Maxis and EA Games. With nearly 9,000 pages, it is an encyclopedia for The Sims that anyone can contribute to. Our mission is to provide all information on The Sims series of games. ",http://images4.wikia.nocookie.net/joeplayground/images/f/f3/Sims2.jpg,http://images2.wikia.nocookie.net/joeplayground/images/f/f7/Sims3.jpg,,,
,The Elder Scrolls Wiki,elderscrolls.wikia.com,Video Games,http://images2.wikia.nocookie.net/joeplayground/images/1/10/ElderScrolls320.jpg,"The Elder Scrolls Wiki consists of over 14,000 articles that document all aspects of every game in The Elder Scrolls series and their expansions. From Arena to Skyrim, everything you need to aid your gameplay can be found here.",http://images1.wikia.nocookie.net/joeplayground/images/3/3b/ElderScrolls2.jpg,http://images1.wikia.nocookie.net/joeplayground/images/0/0f/ElderScrolls3.jpg,,,
,Terraria Wiki,terraria.wikia.com,Video Games,http://images2.wikia.nocookie.net/joeplayground/images/c/c8/Terraria320.jpg,"Whether you're looking for information on monsters, items, weapons, NPCs or crafting recipes, if it exists in Terraria, you'll find it at Terraria Wiki. While you're there, be sure to check out the many helpful videos, as well as the fan art.",http://images3.wikia.nocookie.net/joeplayground/images/1/16/Terraria2.jpg,http://images3.wikia.nocookie.net/joeplayground/images/3/32/Terraria3.jpg,,,
,Star Wars: The Old Republic Wiki,swtor.wikia.com,Video Games,http://images4.wikia.nocookie.net/joeplayground/images/b/b2/SWTOR320.jpg,"The Old Republic Wiki is a fan-created database for Star Wars: The Old Republic including classes, species, locations, starships, creatures, equipment, guilds, and more. You can also find information on Knights of the Old Republic 1 and 2.",http://images4.wikia.nocookie.net/joeplayground/images/6/69/SWTOR2.jpg,http://images2.wikia.nocookie.net/joeplayground/images/0/0d/SWTOR3.jpg,,,
,Sonic News Network,sonic.wikia.com,Video Games,http://images4.wikia.nocookie.net/joeplayground/images/1/13/Sonic320.jpg,"The Sonic News Network is a collaborative encyclopedia for everything related to the Sonic the Hedgehog series, covering the games and their spin-offs, heroes, anti-heroes, villains, comics, shows, and more.",http://images3.wikia.nocookie.net/joeplayground/images/d/d9/Sonic2.jpg,http://images1.wikia.nocookie.net/joeplayground/images/4/49/Sonic3.jpg,,,
,Saints Row Wiki,saintsrow.wikia.com,Video Games,http://images2.wikia.nocookie.net/joeplayground/images/0/0c/SaintsRow320.jpg,"Saints Row Wiki is a community site about the Saints Row series, with mission guides, secrets, maps and more. Discover and contribute your knowledge about Saints Row, Saints Row 2 and Saints Row: The Third! ",http://images2.wikia.nocookie.net/joeplayground/images/c/c0/SaintsRow2.jpg,http://images4.wikia.nocookie.net/joeplayground/images/b/b0/SaintsRow3.jpg,,,
,RuneScape Wiki,runescape.wikia.com,Video Games,http://images3.wikia.nocookie.net/joeplayground/images/6/6e/RuneScape320.jpg,"Started in April of 2005, the RuneScape Wiki's goal is to remain a vast, knowledgeable source for all things in RuneScape. It contains a guide to every quest, a treasure trails guide, and over 20,000 articles about items, locations and monsters.",http://images2.wikia.nocookie.net/joeplayground/images/2/2b/RuneScape2.jpg,http://images3.wikia.nocookie.net/joeplayground/images/3/31/RuneScape3.jpg,,,
,Resident Evil Wiki,residentevil.wikia.com,Video Games,http://images3.wikia.nocookie.net/joeplayground/images/d/de/ResidentEvil320.jpg,"Resident Evil Wiki is one of the largest sources for Resident Evil information on the Internet, containing articles on areas, characters, items, bosses, live-action actors, voice actors, game designers, and much more.",http://images1.wikia.nocookie.net/joeplayground/images/d/d2/ResidentEvil2.jpg,http://images3.wikia.nocookie.net/joeplayground/images/c/c3/ResidentEvil3.jpg,,,
,Red Dead Wiki,reddead.wikia.com,Video Games,http://images4.wikia.nocookie.net/joeplayground/images/3/3e/RedDead320.jpg,"Red Dead Wiki is a community-built site about Red Dead Revolver and Red Dead Redemption where you will find walkthroughs as well as information on characters, weapons, outfits, hunting, activities, multiplayer and more.",http://images2.wikia.nocookie.net/joeplayground/images/f/f5/RedDead2.jpg,http://images4.wikia.nocookie.net/joeplayground/images/4/4e/RedDead3.jpg,,,
,The Morphin Grid,powerrangers.wikia.com,Entertainment,http://images1.wikia.nocookie.net/joeplayground/images/d/d3/PowerRangers320.jpg,"The Morphin Grid is a collaborative repository for everything related to Power Rangers and Super Sentai, covering not only all Ranger Teams' powers, but also every Ranger to ever serve the side of good, and every villain to ever oppose them.",http://images4.wikia.nocookie.net/joeplayground/images/c/c6/PowerRangers2.jpg,http://images4.wikia.nocookie.net/joeplayground/images/1/14/PowerRangers3.jpg,,,
,Pokémon Wiki,pokemon.wikia.com,Video Games,http://images1.wikia.nocookie.net/joeplayground/images/e/ed/Pokemon320.jpg,"Pokémon Wiki is a community-driven site dedicated to the entire Pokémon franchise. With over 5,000 pages, you'll find all generations of Pokémon, as well as information on all of the anime, games, characters, and more.",http://images1.wikia.nocookie.net/joeplayground/images/e/e1/Pokemon2.jpg,http://images4.wikia.nocookie.net/joeplayground/images/c/c9/Pokemon3.jpg,,,
,One Piece Wiki,onepiece.wikia.com,Entertainment,http://images3.wikia.nocookie.net/joeplayground/images/2/2e/OnePiece320.jpg,One Piece Wiki is the encyclopedia for the anime and manga of One Piece. Contribute to the wiki today and help build the most informative site for everything related to Eiichiro Oda and his most notable work.,http://images1.wikia.nocookie.net/joeplayground/images/4/48/OnePiece2.jpg,http://images3.wikia.nocookie.net/joeplayground/images/c/c4/OnePiece3.jpg,,,
,Nukapedia,fallout.wikia.com,Video Games,http://images2.wikia.nocookie.net/joeplayground/images/9/9b/Fallout320.jpg,"Created and maintained by the fans, for the fans, Nukapedia: The Fallout Wiki aims to create the best resource for the Fallout series of games, including Fallout, Fallout 2, Fallout 3, Fallout: New Vegas and their spin-offs. ",http://images2.wikia.nocookie.net/joeplayground/images/4/49/Fallout2.jpg,http://images4.wikia.nocookie.net/joeplayground/images/d/db/Fallout3.jpg,,,
,Narutopedia,naruto.wikia.com,Entertainment,http://images1.wikia.nocookie.net/joeplayground/images/c/cc/Naruto320.jpg,"Narutopedia is the community encyclopedia about the anime, manga, movies, games, and characters of Masashi Kishimoto's Naruto and his dream to become a Hokage, who is acknowledged as the leader and strongest of all ninja in the village. ",http://images1.wikia.nocookie.net/joeplayground/images/3/39/Naruto2.jpg,http://images2.wikia.nocookie.net/joeplayground/images/e/e5/Naruto3.jpg,,,
,Muppet Wiki,muppet.wikia.com,Entertainment,http://images2.wikia.nocookie.net/joeplayground/images/a/a3/480x320-TheMuppetsGroupshot2011.jpg,"With more than 25,000 pages and 75,000 pictures, Muppet Wiki is a collaborative, comprehensive encyclopedia for everything related to Jim Henson, Sesame Street, The Muppet Show, and the Muppets Studio.",http://images2.wikia.nocookie.net/joeplayground/images/a/a5/480x320-sesamestreet2.jpg,http://images2.wikia.nocookie.net/joeplayground/images/c/ca/480x320-TMM-MovieTheater.jpg,,,
,Monster Hunter Wiki,monsterhunter.wikia.com,Video Games,http://images1.wikia.nocookie.net/joeplayground/images/3/3c/MonsterHunter320.jpg,"Hunters unite! Monster Hunter Wiki is the ultimate guide for the Monster Hunter series, documenting all of the games (English and Japanese), monsters, quests, weapons, items, areas, Entertainment and much more. ",http://images4.wikia.nocookie.net/joeplayground/images/a/a0/MonsterHunter2.jpg,http://images4.wikia.nocookie.net/joeplayground/images/9/9e/MonsterHunter3.jpg,,,
,Memory Alpha,en.memory-alpha.org,Entertainment,http://images2.wikia.nocookie.net/joeplayground/images/7/78/MemoryAlpha320.jpg,"Created in 2003 and consisting of more than 38,000 pages, Memory Alpha is a collaborative project to create the most definitive, accurate, and accessible encyclopedia and reference for everything related to Star Trek.",http://images4.wikia.nocookie.net/joeplayground/images/5/57/MemoryAlpha2.jpg,http://images1.wikia.nocookie.net/joeplayground/images/1/12/MemoryAlpha3.jpg,,,
,Mass Effect Wiki,masseffect.wikia.com,Video Games,http://images1.wikia.nocookie.net/joeplayground/images/5/5e/MassEffect320.jpg,"Widely regarded as the most complete resource for Mass Effect on the web, Mass Effect Wiki contains every bit of information you could possibly want to find about this epic trilogy, including the games, books, and comics.",http://images1.wikia.nocookie.net/joeplayground/images/2/2e/MassEffect2.jpg,http://images2.wikia.nocookie.net/joeplayground/images/4/4b/MassEffect3.jpg,,,
,Marvel Comics Database,marvel.wikia.com,Entertainment,http://images2.wikia.nocookie.net/joeplayground/images/e/ee/Marvel320.jpg,"With more than 93,000 pages, the Marvel Comics Database is the largest online database pertaining to Marvel Comics, covering all the comics, characters, and movies. If you are a member of the Marvel fanbase, this is your home.",http://images4.wikia.nocookie.net/joeplayground/images/d/d6/Marvel2.jpg,http://images1.wikia.nocookie.net/joeplayground/images/a/a3/Marvel3.jpg,,,
,Lyric Wiki,lyrics.wikia.com,Entertainment,http://images2.wikia.nocookie.net/joeplayground/images/7/7e/Lyrics320.jpg,"LyricWiki is a free wiki website where anyone can get reliable lyrics for any song by any artist. You can also browse the top songs in iTunes. Search for song lyrics, or add your favorite song to the collection. ",http://images1.wikia.nocookie.net/joeplayground/images/8/85/Lyrics2.jpg,http://images2.wikia.nocookie.net/joeplayground/images/1/1d/Lyrics3.jpg,,,
,League of Legends Wiki,leagueoflegends.wikia.com,Video Games,http://images4.wikia.nocookie.net/joeplayground/images/d/d0/LeagueOfLegends320.jpg,"If you're a LoL player and want the ultimate guide to every aspect of the game, do yourself a favor and bookmark League of Legends Wiki. Here you will find everything you need to optimize your gameplay experience.",http://images1.wikia.nocookie.net/joeplayground/images/1/1b/LeagueOfLegends2.jpg,http://images2.wikia.nocookie.net/joeplayground/images/0/0a/LeagueOfLegends3.jpg,,,
,Harry Potter Wiki,harrypotter.wikia.com,Entertainment,http://images2.wikia.nocookie.net/joeplayground/images/8/82/HarryPotter320.jpg,"Harry Potter Wiki is a collaborative knowledge base about the widely-popular series by J. K. Rowling, including the books, movies, characters, and much more. Join the active community and share your enthusiasm for Harry Potter.",http://images2.wikia.nocookie.net/joeplayground/images/6/65/HarryPotter2.jpg,http://images1.wikia.nocookie.net/joeplayground/images/b/b3/HarryPotter3.jpg,,,
,Halo Nation,halo.wikia.com,Video Games,http://images1.wikia.nocookie.net/joeplayground/images/6/65/Halo320.jpg,"Halo Nation is the best place to learn everything about the Halo franchise. If you're a fan of Halo, this is the place for you. All information held within the wiki are related to Halo, either directly, or peripherally.",http://images2.wikia.nocookie.net/joeplayground/images/5/55/Halo2.jpg,http://images2.wikia.nocookie.net/joeplayground/images/9/92/Halo3.jpg,,,
,Gundam Wiki,gundam.wikia.com,Entertainment,http://images1.wikia.nocookie.net/joeplayground/images/d/d5/Gundam320.jpg,"The objective of Gundam Wiki, which began in January of 2005, is to serve the Gundam fanbase with a thorough and concise resource of information concerning all aspects of the Gundam metaseries, from the ficitional to the scientific.",http://images3.wikia.nocookie.net/joeplayground/images/7/76/Gundam2.jpg,http://images3.wikia.nocookie.net/joeplayground/images/0/04/Gundam3.jpg,,,
,GTA Wiki,gta.wikia.com,Video Games,http://images4.wikia.nocookie.net/joeplayground/images/c/c7/GTA320.jpg,"GTA Wiki is a comprehensive database about the Grand Theft Auto series. The wiki is dedicated to collecting all information relating to GTA, including the games, characters, vehicles, locations, missions, weapons, modifications and more.",http://images4.wikia.nocookie.net/joeplayground/images/d/de/GTA2.jpg,http://images2.wikia.nocookie.net/joeplayground/images/c/c4/GTA3.jpg,,,
,Glee Wiki,glee.wikia.com,Entertainment,http://images1.wikia.nocookie.net/joeplayground/images/3/3b/Glee320.jpg,"Glee Wiki is a community website about the FOX TV show Glee, including Glee Club, cast, Entertainment, episodes, and more. Join the community today and show how much of a Gleek you are by sharing your love of the show. ",http://images1.wikia.nocookie.net/joeplayground/images/5/57/Glee2.jpg,http://images1.wikia.nocookie.net/joeplayground/images/a/a8/Glee3.jpg,,,
,Final Fantasy Wiki,finalfantasy.wikia.com,Video Games,http://images3.wikia.nocookie.net/joeplayground/images/8/8d/FinalFantasy320.jpg,"Covering one of the most well-known video game series of all-time, Final Fantasy Wiki is dedicated to collecting information from elements of storyline and characters to gameplay and Entertainment, as well as everything in between.",http://images4.wikia.nocookie.net/joeplayground/images/6/63/FinalFantasy2.jpg,http://images3.wikia.nocookie.net/joeplayground/images/d/d4/FinalFantasy3.jpg,,,
,FFXIclopedia,wiki.ffxiclopedia.org,Video Games,http://images2.wikia.nocookie.net/joeplayground/images/5/5b/FFXIclopedia320.jpg,"Created in 2004, FFXIclopedia is the ultimate guide to Final Fantasy XI. With nearly 40,000 pages, you'll find a breadth of information covering quests, NPCs, creatures, weapons, armor, items, crafting, and much more.",http://images1.wikia.nocookie.net/joeplayground/images/0/0f/FFXIclopedia2.jpg,http://images2.wikia.nocookie.net/joeplayground/images/0/0d/FFXIclopedia3.jpg,,,
,Fairy Tail Wiki,fairytail.wikia.com,Entertainment,http://images4.wikia.nocookie.net/joeplayground/images/1/17/FairyTail320.jpg,"Fairy Tail Wiki is dedicated to everything about the Fairy Tail manga and anime created by Hiro Mashima. The community's goal is to archive Fairy Tail and all related material, including characters, locations, guilds, and more.",http://images3.wikia.nocookie.net/joeplayground/images/5/52/FairyTail2.jpg,http://images3.wikia.nocookie.net/joeplayground/images/6/6c/FairyTail3.jpg,,,
,EQ2i,eq2.wikia.com,Video Games,http://images1.wikia.nocookie.net/joeplayground/images/c/c5/EverQuest320.jpg,"EQ2i is an award-winning wiki about the MMORPG EverQuest 2 by Sony Online Entertainment, featuring nearly 60,000 pages on a wide variety of topics, such as quests, equipment, items, monsters, NPCs, and zones.",http://images3.wikia.nocookie.net/joeplayground/images/c/c1/Everquest2.jpg,http://images3.wikia.nocookie.net/joeplayground/images/9/99/Everquest3.jpg,,,
,DragonVale Wiki,dragonvale.wikia.com,Video Games,http://images2.wikia.nocookie.net/joeplayground/images/1/16/Dragonvale320.jpg,"DragonVale Wiki is an in-depth database for the popular iOS game, DragonVale. The wiki contains information on dragons, eggs, breeding, the market, treasure, habitats, islands, decorations, goals, rewards, updates, and more.",http://images3.wikia.nocookie.net/joeplayground/images/f/fd/Dragonvale2.jpg,http://images2.wikia.nocookie.net/joeplayground/images/d/d8/Dragonvale3.jpg,,,
,Dragon Ball Wiki,dragonball.wikia.com,Entertainment,http://images4.wikia.nocookie.net/joeplayground/images/2/2d/DragonBall320.jpg,"Dragon Ball Wiki covers all things related to the Dragon Ball franchise created by Akira Toriyama, including the manga series, three anime series, characters, collectible card game, and dozens of video game spin-offs.",http://images2.wikia.nocookie.net/joeplayground/images/a/a0/Dragonball2.jpg,http://images2.wikia.nocookie.net/joeplayground/images/2/2c/Dragonball3.jpg,,,
,Dragon Age Wiki,dragonage.wikia.com,Video Games,http://images3.wikia.nocookie.net/joeplayground/images/5/5c/DragonAge320.jpg,"Highly regarded by BioWare themselves, Dragon Age Wiki is the undisputed #1 resource for the Dragon Age franchise. In addition to information on the novels and comics, you will find an unmatched level of depth covering every detail of the games.",http://images1.wikia.nocookie.net/joeplayground/images/7/77/DragonAge2.jpg,http://images2.wikia.nocookie.net/joeplayground/images/4/40/DragonAge3.jpg,,,
,DisneyWiki,disney.wikia.com,Entertainment,http://images4.wikia.nocookie.net/joeplayground/images/3/36/Disney320.jpg,"DisneyWiki is a collaborative encyclopedia for everything related to Walt Disney and his work. Here you can find, create, and edit articles on Disney theme parks, film companies, television networks, films, characters, and more! ",http://images3.wikia.nocookie.net/joeplayground/images/1/17/Disney2.jpg,http://images3.wikia.nocookie.net/joeplayground/images/d/de/Disney3.jpg,,,
,Digimon Wiki,digimon.wikia.com,Entertainment,http://images4.wikia.nocookie.net/joeplayground/images/d/dc/Digimon320.jpg,"Digimon Wiki is an in-depth, collaborative encyclopedia on all things Digimon, including the anime series and movies, manga chapters, characters, video games, cards, Entertainment, and Entertainment, as well a list of the best Digimon fan fiction on the web.",http://images2.wikia.nocookie.net/joeplayground/images/2/21/Digimon2.jpg,http://images2.wikia.nocookie.net/joeplayground/images/7/74/Digimon3.jpg,,,
,DC Comics Database,dc.wikia.com,Entertainment,http://images3.wikia.nocookie.net/joeplayground/images/d/d6/DC320.jpg,"With more than 71,000 pages, the DC Comics Database is the largest online database pertaining to DC Comics, covering all the comics, characters, and movies. If you are a member of the DC fanbase, this is your home.",http://images1.wikia.nocookie.net/joeplayground/images/1/16/DC2.jpg,http://images2.wikia.nocookie.net/joeplayground/images/c/cc/DC3.jpg,,,
,Call of Duty Wiki,callofduty.wikia.com,Video Games,http://images1.wikia.nocookie.net/joeplayground/images/7/7a/CallOfDuty320.jpg,"Call of Duty Wiki is filled with information about the characters, locations, weapons, and history of the world's best-selling first-person shooter series along with useful information for the multiplayer aspect of the games.",http://images2.wikia.nocookie.net/joeplayground/images/1/13/CallOfDuty2.jpg,http://images3.wikia.nocookie.net/joeplayground/images/3/34/CallOfDuty3.jpg,,,
,Brickipedia,lego.wikia.com,Entertainment,http://images2.wikia.nocookie.net/joeplayground/images/b/b8/Brickipedia320.jpg,"Brickipedia is a popular, well-known website, consisting of over 19,000 pages and counting, with users who strive to show off their knowledge for LEGO. Join the community and share your love of LEGO today.",http://images2.wikia.nocookie.net/joeplayground/images/d/d3/Brickipedia2.jpg,http://images2.wikia.nocookie.net/joeplayground/images/8/82/Brickipedia3.jpg,,,
,Bleach Wiki,bleach.wikia.com,Entertainment,http://images2.wikia.nocookie.net/joeplayground/images/1/11/Bleach320.jpg,"Leading the web as the most complete source of knowledge for the Bleach universe, Bleach Wiki covers all of the the manga chapters, anime episodes, characters, races, Entertainment, books, games, movies, and more. ",http://images1.wikia.nocookie.net/joeplayground/images/4/4e/Bleach2.jpg,http://images3.wikia.nocookie.net/joeplayground/images/5/59/Bleach3.jpg,,,
,Beyblade Wiki,beyblade.wikia.com,Entertainment,http://images2.wikia.nocookie.net/joeplayground/images/a/ad/Beyblade320.jpg,"Beyblade Wiki is a collaborative database about the various seasons of the Beyblade anime series, as well as every Beyblade toy. The goal of Beyblade Wiki is to become the largest online database for all things Beyblade.",http://images2.wikia.nocookie.net/joeplayground/images/0/04/Beyblade2.jpg,http://images4.wikia.nocookie.net/joeplayground/images/2/21/Beyblade3.jpg,,,
,Ben 10 Planet,ben10.wikia.com,Entertainment,http://images2.wikia.nocookie.net/joeplayground/images/8/86/Ben10-320.jpg,"Ben 10 Planet is the ultimate resource for the Ben 10 franchise, consisting of 10,000 pictures and over 1,600 pages of detailed information on the TV series as well as the animated and live-action movies.",http://images3.wikia.nocookie.net/joeplayground/images/1/10/Ben10-2.jpg,http://images2.wikia.nocookie.net/joeplayground/images/f/ff/Ben10-3.jpg,,,
,Battlefield Wiki,battlefield.wikia.com,Video Games,http://images1.wikia.nocookie.net/joeplayground/images/d/d2/Battlefield320.jpg,"Battlefield Wiki is a collaborative encyclopedia dedicated to the Battlefield series, from Battlefield 1942 to Battlefield 3 and everything in between. You'll find information on the multiplayer maps, single-player levels, weapons, vehicles, and more.",http://images3.wikia.nocookie.net/joeplayground/images/2/23/Battlefield2.jpg,http://images2.wikia.nocookie.net/joeplayground/images/b/b6/Battlefield3.jpg,,,
,Batman Wiki,batman.wikia.com,Entertainment,http://images4.wikia.nocookie.net/joeplayground/images/7/7e/Batman320.jpg,"Batman Wiki is a fan-made knowledge base devoted to covering the heroes and villains of the entire Batman franchise, including the comics, animated and live-action TV series and movies, video games, Entertainment, and books.",http://images1.wikia.nocookie.net/joeplayground/images/6/60/Batman2.jpg,http://images3.wikia.nocookie.net/joeplayground/images/3/30/Batman3.jpg,,,
,Assassin's Creed Wiki,assassinscreed.wikia.com,Video Games,http://images1.wikia.nocookie.net/joeplayground/images/3/38/AssassinsCreed320.jpg,"With its thriving community, Assassin's Creed Wiki is an effort to document everything about the Assassin's Creed series, from basic game information to guides to the story. Be sure to also check out the Fan section.",http://images1.wikia.nocookie.net/joeplayground/images/8/88/AssassinsCreed2.jpg,http://images1.wikia.nocookie.net/joeplayground/images/4/4a/AssassinsCreed3.jpg,,,
,The Binding of Isaac Wiki,bindingofisaac.wikia.com,Video Games,http://images3.wikia.nocookie.net/joeplayground/images/b/bd/BindingOfIsaac320.jpg,"The Binding of Isaac Wiki covers all of the items, rooms, monsters, bosses, secrets, achievements, playable characters and everything else in Edmund McMillen and Florian Himsl's game, The Binding of Isaac. ",http://images1.wikia.nocookie.net/joeplayground/images/9/98/BindingOfIsaac2.jpg,http://images1.wikia.nocookie.net/joeplayground/images/1/1b/BindingOfIsaac3.jpg,,,
,Anno 2070 Wiki,anno2070.wikia.com,Video Games,http://images2.wikia.nocookie.net/joeplayground/images/1/1f/Anno2070-320.jpg,"Anno 2070 Wiki is a comprehensive guide for the city-building strategy game, Anno 2070. You'll find information on each of the factions and their buildings, as well as guides for combat, power, production, research, and much more.",http://images2.wikia.nocookie.net/joeplayground/images/c/c4/Anno2070-2.jpg,http://images4.wikia.nocookie.net/joeplayground/images/8/8f/Anno2070-3.jpg,,,
